titles,pubDates,links
Canada's Competition Bureau appealing tribunal decision that ... - CBC.ca,2022-12-30 08:00:00,https://news.google.com/__i/rss/rd/articles/CBMiW2h0dHBzOi8vd3d3LmNiYy5jYS9uZXdzL2J1c2luZXNzL3JvZ2Vycy1zaGF3LW1lcmdlci1jb21wZXRpdGlvbi10cmlidW5hbC1kZWNpc2lvbi0xLjY3MDAxNDbSAQA?oc=5
Pierre Poilievre promises new law against government jargon - CBC.ca,2022-09-01 07:00:00,https://news.google.com/__i/rss/rd/articles/CBMiS2h0dHBzOi8vd3d3LmNiYy5jYS9uZXdzL3BvbGl0aWNzL3BpZXJyZS1wb2lsaWV2cmUtc2ltcGxlLWxhbmd1YWdlLTEuNjU3MDEyOdIBAA?oc=5
Bank of Canada refutes 'printing money' misinformation on Twitter - CBC.ca,2022-08-31 07:00:00,https://news.google.com/__i/rss/rd/articles/CBMiTWh0dHBzOi8vd3d3LmNiYy5jYS9uZXdzL2J1c2luZXNzL2JhbmstY2FuYWRhLXR3aXR0ZXItcHJpbnRpbmctbW9uZXktMS42NTY4NDY20gEA?oc=5
Canadian politics has a rage problem — and politicians have to be ... - CBC.ca,2022-08-30 07:00:00,https://news.google.com/__i/rss/rd/articles/CBMiSWh0dHBzOi8vd3d3LmNiYy5jYS9uZXdzL3BvbGl0aWNzL3BvbGl0aWNzLWNhbmFkYS1hbmdlci1mcmVlbGFuZC0xLjY1NjY1NjfSAQA?oc=5
"All this constitutional chaos, and Danielle Smith hasn't won anything ... - CBC.ca",2022-09-02 07:00:00,https://news.google.com/__i/rss/rd/articles/CBMifGh0dHBzOi8vd3d3LmNiYy5jYS9uZXdzL2NhbmFkYS9jYWxnYXJ5L2RhbmllbGxlLXNtaXRoLWFsYmVydGEtc292ZXJlaWdudHktYWN0LWxpZXV0ZW5hbnQtZ292ZXJub3ItdW5jb25zdGl0dXRpb25hbC0xLjY1NzE3ODPSAQA?oc=5
United Conservative Party leadership hopefuls vie to sound ... - CBC.ca,2022-08-30 07:00:00,https://news.google.com/__i/rss/rd/articles/CBMijAFodHRwczovL3d3dy5jYmMuY2EvbmV3cy9jYW5hZGEvZWRtb250b24vdW5pdGVkLWNvbnNlcnZhdGl2ZS1wYXJ0eS1sZWFkZXJzaGlwLWhvcGVmdWxzLWF0dGVtcHQtdG8tc291bmQtZGlzdGluY3RpdmUtaW4tZmluYWwtZGViYXRlLTEuNjU2NjE1M9IBAA?oc=5
Erin O'Toole to appear by video at Conservative leadership event - CBC.ca,2022-09-02 07:00:00,https://news.google.com/__i/rss/rd/articles/CBMiRWh0dHBzOi8vd3d3LmNiYy5jYS9uZXdzL3BvbGl0aWNzL2VyaW4tb3Rvb2xlLWNwYy1jb252ZW50aW9uLTEuNjU3MTQ2MtIBAA?oc=5
Former B.C. premier Christy Clark endorses Jean Charest in Tory race - CBC.ca,2022-08-11 07:00:00,https://news.google.com/__i/rss/rd/articles/CBMiamh0dHBzOi8vd3d3LmNiYy5jYS9uZXdzL2NhbmFkYS9icml0aXNoLWNvbHVtYmlhL2NocmlzdHktY2xhcmstamVhbi1jaGFyZXN0LWNvbnNlcnZhdGl2ZXMtZmVkZXJhbC0xLjY1NDkxMTLSAQA?oc=5
The Charest-Poilievre clash is a conflict over Conservative identity - CBC.ca,2022-03-12 08:00:00,https://news.google.com/__i/rss/rd/articles/CBMiVGh0dHBzOi8vd3d3LmNiYy5jYS9uZXdzL3BvbGl0aWNzL2NoYXJlc3QtcG9pbGlldnJlLWNvbnNlcnZhdGl2ZS1sZWFkZXJzaGlwLTEuNjM4MTk4NdIBAA?oc=5
"Brown, Poilievre trade shots over niqab ban as Conservative ... - CBC.ca",2022-03-14 07:00:00,https://news.google.com/__i/rss/rd/articles/CBMiT2h0dHBzOi8vd3d3LmNiYy5jYS9uZXdzL3BvbGl0aWNzL2Jyb3duLXBvaWxpZXZyZS1uaXFhYi1iYW4tY2FyYm9uLXRheC0xLjYzODQxOTTSAQA?oc=5
Conservative leadership candidate Jean Charest says he has the ... - CBC.ca,2022-03-18 07:00:00,https://news.google.com/__i/rss/rd/articles/CBMiTWh0dHBzOi8vd3d3LmNiYy5jYS9uZXdzL3BvbGl0aWNzL2NoYXJlc3QtcG93ZXItYW5kLXBvbGl0aWNzLW1hcmNoMTgtMS42MzkwNzA50gEA?oc=5
Pierre Poilievre tells Calgary supporters he'll build pipelines in all ... - CBC.ca,2022-04-13 07:00:00,https://news.google.com/__i/rss/rd/articles/CBMiSGh0dHBzOi8vd3d3LmNiYy5jYS9uZXdzL2NhbmFkYS9jYWxnYXJ5L3BvaWxpZXZyZS1jYWxnYXJ5LXJhbGx5LTEuNjQxODQ3NNIBAA?oc=5
Liberals dismiss accusations they intend to slap a green tax on ... - CBC.ca,2022-04-15 07:00:00,https://news.google.com/__i/rss/rd/articles/CBMif2h0dHBzOi8vd3d3LmNiYy5jYS9uZXdzL2NhbmFkYS9lZG1vbnRvbi9saWJlcmFscy1kaXNtaXNzLWFjY3VzYXRpb25zLXRoZXktaW50ZW5kLXRvLXNsYXAtYS1ncmVlbi10YXgtb24tcGlja3VwLXRydWNrcy0xLjY0MjEzODTSAQA?oc=5
Candidates vying for Conservative leadership to meet for first ... - CBC.ca,2022-04-11 07:00:00,https://news.google.com/__i/rss/rd/articles/CBMiUmh0dHBzOi8vd3d3LmNiYy5jYS9uZXdzL3BvbGl0aWNzL2NvbnNlcnZhdGl2ZS1sZWFkZXJzaGlwLWRlYmF0ZS1zY2hlZHVsZS0xLjY0MTYyMjXSAQA?oc=5
Fixer says former Alberta justice minister hired him to get reporter's ... - CBC.ca,2022-04-11 07:00:00,https://news.google.com/__i/rss/rd/articles/CBMicGh0dHBzOi8vd3d3LmNiYy5jYS9uZXdzL2NhbmFkYS9jYWxnYXJ5L2RlbmlzLWFsYmVydGEtanVzdGljZS1taW5pc3Rlci1mb3JtZXItZml4ZXItcGhvbmUtbG9ncy1yZXBvcnRlci0xLjY0MTU1MzLSAQA?oc=5
'Blood sport': Observers say purported emails suggest decline of Alberta politics - CBC.ca,2022-04-12 07:00:00,https://news.google.com/__i/rss/rd/articles/CBMigAFodHRwczovL3d3dy5jYmMuY2EvbmV3cy9jYW5hZGEvZWRtb250b24vYmxvb2Qtc3BvcnQtb2JzZXJ2ZXJzLXNheS1wdXJwb3J0ZWQtZW1haWxzLXN1Z2dlc3QtZGVjbGluZS1vZi1hbGJlcnRhLXBvbGl0aWNzLTEuNjQxNzc5NNIBIGh0dHBzOi8vd3d3LmNiYy5jYS9hbXAvMS42NDE3Nzk0?oc=5
A family from Syria shares their rituals and recipes during the holy ... - CBC.ca,2022-04-14 07:00:00,https://news.google.com/__i/rss/rd/articles/CBMiW2h0dHBzOi8vd3d3LmNiYy5jYS9uZXdzL2NhbmFkYS9icml0aXNoLWNvbHVtYmlhL3JhbWFkYW4tc3lyaWFuLWZhbWlseS1kb2N1bWVudGFyeS0xLjY0MTY1MjjSAQA?oc=5
Backyard chicken owners have a role to play in preventing spread of ... - CBC.ca,2022-04-14 07:00:00,https://news.google.com/__i/rss/rd/articles/CBMiZmh0dHBzOi8vd3d3LmNiYy5jYS9uZXdzL2NhbmFkYS9icml0aXNoLWNvbHVtYmlhL2JhY2t5YXJkLWNoaWNrZW4tb3duZXJzLXByZXZlbnRpbmctYXZpYW4tZmx1LTEuNjQxOTA2MtIBAA?oc=5
Dhaliwal Homes Ltd. faces 51 charges after building code investigation - CBC.ca,2022-04-13 07:00:00,https://news.google.com/__i/rss/rd/articles/CBMiYGh0dHBzOi8vd3d3LmNiYy5jYS9uZXdzL2NhbmFkYS9jYWxnYXJ5L2NpdHktY2FsZ2FyeS1zYWZldHktY29kZS1jaGFyZ2VzLWRoYWxpd2FsLWhvbWVzLTEuNjQxODYzN9IBIGh0dHBzOi8vd3d3LmNiYy5jYS9hbXAvMS42NDE4NjM3?oc=5
"B.C.'s child vaccine rate stalls at 57%, lagging behind other ... - CBC.ca",2022-04-13 07:00:00,https://news.google.com/__i/rss/rd/articles/CBMiU2h0dHBzOi8vd3d3LmNiYy5jYS9uZXdzL2NhbmFkYS9icml0aXNoLWNvbHVtYmlhL2JjLWNoaWxkLXZhY2NpbmF0aW9uLXJhdGUtMS42NDE3NDUy0gEA?oc=5
B.C. government worker union says contract talks hit impasse over ... - CBC.ca,2022-04-12 07:00:00,https://news.google.com/__i/rss/rd/articles/CBMigAFodHRwczovL3d3dy5jYmMuY2EvbmV3cy9jYW5hZGEvYnJpdGlzaC1jb2x1bWJpYS9iLWMtZ292ZXJubWVudC13b3JrZXItdW5pb24tc2F5cy1jb250cmFjdC10YWxrcy1oaXQtaW1wYXNzZS1vdmVyLXdhZ2VzLTEuNjQxNzkyNtIBAA?oc=5
1 dead after tree falls on moving car in South Vancouver - CBC.ca,2022-04-12 07:00:00,https://news.google.com/__i/rss/rd/articles/CBMiUmh0dHBzOi8vd3d3LmNiYy5jYS9uZXdzL2NhbmFkYS9icml0aXNoLWNvbHVtYmlhLzEtZGVhZC10cmVlLWZhbGxzLW9uLWNhci0xLjY0MTc5NjbSAQA?oc=5
Valuable bronze sculpture stolen from B.C. Children's Hospital - CBC.ca,2022-04-15 07:00:00,https://news.google.com/__i/rss/rd/articles/CBMiTWh0dHBzOi8vd3d3LmNiYy5jYS9uZXdzL2NhbmFkYS9icml0aXNoLWNvbHVtYmlhL2hvc3BpdGFsLXN0b2xlbi1hcnQtMS42NDE4Njk50gEA?oc=5
Sen. Paula Simons suggests Alberta seek constitutional amendment to tax railway - CBC.ca,2022-04-14 07:00:00,https://news.google.com/__i/rss/rd/articles/CBMiW2h0dHBzOi8vd3d3LmNiYy5jYS9uZXdzL2NhbmFkYS9jYWxnYXJ5L2NvbnN0aXR1dGlvbi1hbWVuZG1lbnQtY3ByLWV4ZW1wdGlvbi10YXhlcy0xLjY0MTkxMjTSASBodHRwczovL3d3dy5jYmMuY2EvYW1wLzEuNjQxOTEyNA?oc=5
Kitsilano pool may not open this summer due to damage from ... - CBC.ca,2022-04-12 07:00:00,https://news.google.com/__i/rss/rd/articles/CBMiV2h0dHBzOi8vd3d3LmNiYy5jYS9uZXdzL2NhbmFkYS9icml0aXNoLWNvbHVtYmlhL2tpdHNpbGFuby1wb29sLXJlbWFpbnMtY2xvc2VkLTEuNjQxNzU5M9IBAA?oc=5
B.C. Ferries crew rescue fishermen from burning boat near Prince ... - CBC.ca,2022-04-12 07:00:00,https://news.google.com/__i/rss/rd/articles/CBMiW2h0dHBzOi8vd3d3LmNiYy5jYS9uZXdzL2NhbmFkYS9icml0aXNoLWNvbHVtYmlhL2ItYy1mZXJyaWVzLWNyZXctcmVzY3VlLWZpc2hlcm1lbi0xLjY0MTczNTPSAQA?oc=5
Man presumed drowned after falling off sailboat near Nanaimo - CBC.ca,2022-04-12 07:00:00,https://news.google.com/__i/rss/rd/articles/CBMidmh0dHBzOi8vd3d3LmNiYy5jYS9uZXdzL2NhbmFkYS9icml0aXNoLWNvbHVtYmlhL21hbi1wcmVzdW1lZC1kcm93bmVkLWFmdGVyLWZhbGxpbmctb2ZmLXNhaWxib2F0LW5lYXItbmFuYWltby0xLjY0MTc5MTjSASBodHRwczovL3d3dy5jYmMuY2EvYW1wLzEuNjQxNzkxOA?oc=5
B.C. artist honours memories of past Lower Mainland Vaisakhi parades with new illustrated series - CBC.ca,2022-04-14 07:00:00,https://news.google.com/__i/rss/rd/articles/CBMiTmh0dHBzOi8vd3d3LmNiYy5jYS9uZXdzL2NhbmFkYS9icml0aXNoLWNvbHVtYmlhL2xvc3QtdmFpc2FraGktc2VyaWVzLTEuNjQxNzUxN9IBIGh0dHBzOi8vd3d3LmNiYy5jYS9hbXAvMS42NDE3NTE3?oc=5
Jean Charest to launch Conservative leadership bid Thursday ... - CBC.ca,2022-03-08 08:00:00,https://news.google.com/__i/rss/rd/articles/CBMiSmh0dHBzOi8vd3d3LmNiYy5jYS9uZXdzL3BvbGl0aWNzL2NoYXJlc3QtbGVhZGVyc2hpcC1hbm5vdW5jZW1lbnQtMS42Mzc2MzY30gEA?oc=5
Jean Charest formally launches Conservative Party leadership bid ... - CBC.ca,2022-03-11 08:00:00,https://news.google.com/__i/rss/rd/articles/CBMiYWh0dHBzOi8vd3d3LmNiYy5jYS9uZXdzL2NhbmFkYS9jYWxnYXJ5L2plYW4tY2hhcmVzdC1sZWFkZXJzaGlwLWNvbnNlcnZhdGl2ZS1jcGMtY2FsZ2FyeS0xLjYzODA5NjTSAQA?oc=5
Independent Ontario MPP Roman Baber to enter Conservative party ... - CBC.ca,2022-03-09 08:00:00,https://news.google.com/__i/rss/rd/articles/CBMiZmh0dHBzOi8vd3d3LmNiYy5jYS9uZXdzL2NhbmFkYS90b3JvbnRvL3JvbWFuLWJhYmVyLWVudGVycy1jb25zZXJ2YXRpdmUtcGFydHktbGVhZGVyc2hpcC1yYWNlLTEuNjM3ODIzNNIBAA?oc=5
Jason Kenney's win-win-win announcement might not give him the ... - CBC.ca,2022-03-08 08:00:00,https://news.google.com/__i/rss/rd/articles/CBMiY2h0dHBzOi8vd3d3LmNiYy5jYS9uZXdzL2NhbmFkYS9jYWxnYXJ5L29waW5pb24tamFzb24ta2VubmV5LXByb3ZpbmNpYWwtZ2FzLXRheC1zdXNwZW5zaW9uLTEuNjM3NzA3MNIBAA?oc=5
Secret trackers and hidden cameras expose how some movers ... - CBC.ca,2022-03-06 08:00:00,https://news.google.com/__i/rss/rd/articles/CBMiRWh0dHBzOi8vd3d3LmNiYy5jYS9uZXdzL2NhbmFkYS9tYXJrZXRwbGFjZS1tb3ZpbmctY29tcGFuaWVzLTEuNjM3MTI2MtIBAA?oc=5
Where to watch this year's Oscar-nominated films - CBC.ca,2022-03-05 08:00:00,https://news.google.com/__i/rss/rd/articles/CBMiTWh0dHBzOi8vd3d3LmNiYy5jYS9uZXdzL2VudGVydGFpbm1lbnQvb3NjYXItbm9taW5lZXMtMjAyMi1zdHJlYW1pbmctMS42MzczMjk10gEA?oc=5
Pierre Poilievre becomes 1st to announce bid for Conservative Party ... - CBC.ca,2022-02-06 08:00:00,https://news.google.com/__i/rss/rd/articles/CBMiX2h0dHBzOi8vd3d3LmNiYy5jYS9uZXdzL3BvbGl0aWNzL3BpZXJyZS1wb2lsaWV2cmUtcnVubmluZy1mb3ItY29uc2VydmF0aXZlLWxlYWRlcnNoaXAtMS42MzQxMzM10gEA?oc=5
Former Quebec premier Jean Charest courted by Conservative MP ... - CBC.ca,2022-02-07 08:00:00,https://news.google.com/__i/rss/rd/articles/CBMiZWh0dHBzOi8vd3d3LmNiYy5jYS9uZXdzL2NhbmFkYS9tb250cmVhbC9jb25zZXJ2YXRpdmVzLWV5ZS1jaGFyZXN0LWFzLXBvdGVudGlhbC1sZWFkZXItYWdhaW4tMS42MzQyMzcz0gEA?oc=5
Federal Conservatives call on anti-vaccine mandate protesters to ... - CBC.ca,2022-02-11 08:00:00,https://news.google.com/__i/rss/rd/articles/CBMiTmh0dHBzOi8vd3d3LmNiYy5jYS9uZXdzL3BvbGl0aWNzL2NvbnNlcnZhdGl2ZXMtY292aWQtMTktcmVzdHJpY3Rpb25zLTEuNjM0NjU3NtIBAA?oc=5
New Brunswick MP defends his support for truckers protesting ... - CBC.ca,2022-02-07 08:00:00,https://news.google.com/__i/rss/rd/articles/CBMiVmh0dHBzOi8vd3d3LmNiYy5jYS9uZXdzL2NhbmFkYS9uZXctYnJ1bnN3aWNrL3N0ZXdhcnQtZGVmZW5kcy10cnVja2VyLXN1cHBvcnQtMS42MzQwMDY40gEA?oc=5
The protest convoy could cast a long shadow in Canadian politics - CBC.ca,2022-02-08 08:00:00,https://news.google.com/__i/rss/rd/articles/CBMiWGh0dHBzOi8vd3d3LmNiYy5jYS9uZXdzL3BvbGl0aWNzL2NvbnZveS1wcm90ZXN0LWNvdmlkLXBhbmRlbWljLXZhY2NpbmUtdHJ1ZGVhdS0xLjYzNDQwNzTSAQA?oc=5
"Ontario deficit will shrink more than predicted by province, watchdog ... - CBC.ca",2022-02-08 08:00:00,https://news.google.com/__i/rss/rd/articles/CBMiTGh0dHBzOi8vd3d3LmNiYy5jYS9uZXdzL2NhbmFkYS90b3JvbnRvL29udC1mYW8tYnVkZ2V0LW91dGxvb2stMjAyMi0xLjYzNDMzNzDSAQA?oc=5
What the Conservatives' critics list says about Poilievre's approach ... - CBC.ca,2022-10-16 07:00:00,https://news.google.com/__i/rss/rd/articles/CBMiVWh0dHBzOi8vd3d3LmNiYy5jYS9uZXdzL3BvbGl0aWNzL3BvaWxpZXZyZS1leHBlcnRzLXBhcmxpYW1lbnQtY3JpdGljcy1iZW5jaC0xLjY2MTY4NzfSAQA?oc=5
Premier Ford's 'shoulder to shoulder' comment about Trudeau ... - CBC.ca,2022-10-19 07:00:00,https://news.google.com/__i/rss/rd/articles/CBMiZGh0dHBzOi8vd3d3LmNiYy5jYS9uZXdzL3BvbGl0aWNzL2RvdWctZm9yZC1qdXN0aW4tdHJ1ZGVhdS1lbWVyZ2VuY2llcy1hY3QtY29udm95LXBvaWxpZXZyZS0xLjY2MjA4NjnSAQA?oc=5
Freeland warns of 'difficult days ahead' as Canada's economy ... - CBC.ca,2022-10-19 07:00:00,https://news.google.com/__i/rss/rd/articles/CBMiUGh0dHBzOi8vd3d3LmNiYy5jYS9uZXdzL3BvbGl0aWNzL2ZyZWVsYW5kLWRpZmZpY3VsdC1kYXlzLWFoZWFkLWVjb25vbXktMS42NjIxODAw0gEA?oc=5
The NDP suffered from a credibility gap in 2021 — and Singh's ... - CBC.ca,2022-10-16 07:00:00,https://news.google.com/__i/rss/rd/articles/CBMiSWh0dHBzOi8vd3d3LmNiYy5jYS9uZXdzL3BvbGl0aWNzL25kcC1zaW5naC1jcmVkaWJpbGl0eS1lbGVjdGlvbi0xLjY2MTQzMDbSAQA?oc=5
Prime minister says police need more support in wake of Burnaby ... - CBC.ca,2022-10-19 07:00:00,https://news.google.com/__i/rss/rd/articles/CBMidWh0dHBzOi8vd3d3LmNiYy5jYS9uZXdzL2NhbmFkYS9icml0aXNoLWNvbHVtYmlhL2hvdXNlLW9mLWNvbW1vbnMtcGF5cy10cmlidXRlLXRvLWItYy1vZmZpY2VyLWtpbGxlZC1vbi1kdXR5LTEuNjYyMjQ5NdIBAA?oc=5
Danielle Smith's populist playbook: make the dominant feel ... - CBC.ca,2022-10-19 07:00:00,https://news.google.com/__i/rss/rd/articles/CBMiWWh0dHBzOi8vd3d3LmNiYy5jYS9uZXdzL2NhbmFkYS9jYWxnYXJ5L29waW5pb24tZGFuaWVsbGUtc21pdGgtcG9wdWxpc20tcGxheWJvb2stMS42NjE3MDU50gEA?oc=5
Loblaw's decision to freeze prices on all No Name items until ... - CBC.ca,2022-10-17 07:00:00,https://news.google.com/__i/rss/rd/articles/CBMiS2h0dHBzOi8vd3d3LmNiYy5jYS9uZXdzL2J1c2luZXNzL2xvYmxhdy1ncm9jZXJ5LWluZmxhdGlvbi1uby1uYW1lLTEuNjYxODgyOdIBAA?oc=5
Environment minister asks banks to make carbon price rebate ... - CBC.ca,2022-10-17 07:00:00,https://news.google.com/__i/rss/rd/articles/CBMiSWh0dHBzOi8vd3d3LmNiYy5jYS9uZXdzL3BvbGl0aWNzL2NhcmJvbi1wcmljaW5nLXJlYmF0ZS1kZXBvc2l0cy0xLjY2MTkwOTfSAQA?oc=5
Trudeau says Canada is not falling behind the U.S. on climate action - CBC.ca,2022-10-18 07:00:00,https://news.google.com/__i/rss/rd/articles/CBMiR2h0dHBzOi8vd3d3LmNiYy5jYS9uZXdzL3BvbGl0aWNzL3RydWRlYXUtY2xpbWF0ZS1jaGFuZ2UtYmlkZW4tMS42NjIxMDcw0gEA?oc=5
Alleged U.S. human smuggler under investigation by RCMP in ... - CBC.ca,2022-10-20 07:00:00,https://news.google.com/__i/rss/rd/articles/CBMibGh0dHBzOi8vd3d3LmNiYy5jYS9uZXdzL2NhbmFkYS9yY21wLWludmVzdGlnYXRpb24tYWxsZWdlZC1odW1hbi1zbXVnZ2xlci1wYXRlbC1mYW1pbHktZGVhdGgtYm9yZGVyLTEuNjYxNjYyMNIBAA?oc=5
"Poilievre unveils critics list, pits Alberta MP Jasraj Singh Hallan ... - CBC.ca",2022-10-12 07:00:00,https://news.google.com/__i/rss/rd/articles/CBMiS2h0dHBzOi8vd3d3LmNiYy5jYS9uZXdzL3BvbGl0aWNzL3BvaWxpZXZyZS11bnZlaWxzLXNoYWRvdy1jYWJpbmV0LTEuNjYxMzcwMtIBAA?oc=5
"Stung by criticism, Trudeau government changes course on Iran - CBC.ca",2022-10-08 07:00:00,https://news.google.com/__i/rss/rd/articles/CBMiSmh0dHBzOi8vd3d3LmNiYy5jYS9uZXdzL3BvbGl0aWNzL2lyYW4tdHJ1ZGVhdS1wcm90ZXN0cy1wb2lsaWV2cmUtMS42NjA4NzU20gEA?oc=5
Now the Danielle Smith Show reckons with a new audience: the ... - CBC.ca,2022-10-08 07:00:00,https://news.google.com/__i/rss/rd/articles/CBMiWWh0dHBzOi8vd3d3LmNiYy5jYS9uZXdzL2NhbmFkYS9jYWxnYXJ5L2RhbmllbGxlLXNtaXRoLXNob3ctYXVkaWVuY2UtYWxiZXJ0YS11Y3AtMS42NjEwNjI30gEA?oc=5
"Cardy resigns as N.B. education minister, sends scorching letter to ... - CBC.ca",2022-10-13 07:00:00,https://news.google.com/__i/rss/rd/articles/CBMiWmh0dHBzOi8vd3d3LmNiYy5jYS9uZXdzL2NhbmFkYS9uZXctYnJ1bnN3aWNrL2NhcmR5LXJlc2lnbnMtYXMtZWR1Y2F0aW9uLW1pbmlzdGVyLTEuNjYxNTA4M9IBAA?oc=5
"Military eases vaccine mandate, presses ahead with discipline for ... - CBC.ca",2022-10-14 07:00:00,https://news.google.com/__i/rss/rd/articles/CBMiTmh0dHBzOi8vd3d3LmNiYy5jYS9uZXdzL3BvbGl0aWNzL21pbGl0YXJ5LXZhY2NpbmUtbWFuZGF0ZS1kaXNjaXBsaW5lLTEuNjYxNjQyNNIBAA?oc=5
'No evidence at the time' of foreign interference in 2019 federal ... - CBC.ca,2022-11-29 08:00:00,https://news.google.com/__i/rss/rd/articles/CBMiVmh0dHBzOi8vd3d3LmNiYy5jYS9uZXdzL3BvbGl0aWNzL3JjbXAtZm9yZWlnbi1pbnRlcmZlcmVuY2UtZGVjbGluZS1kb2N1bWVudHMtMS42NjY3NjYx0gEA?oc=5
Ministerial staff shared info about soldiers' role in self-styled ... - CBC.ca,2022-12-01 08:00:00,https://news.google.com/__i/rss/rd/articles/CBMiRWh0dHBzOi8vd3d3LmNiYy5jYS9uZXdzL3BvbGl0aWNzL3N0YWZmLWluZm8tc29sZGllcnMtY29udm95LTEuNjY3MTExN9IBAA?oc=5
Hockey fans can likely bet on seeing more gambling-related ... - CBC.ca,2022-11-27 08:00:00,https://news.google.com/__i/rss/rd/articles/CBMiWGh0dHBzOi8vd3d3LmNiYy5jYS9uZXdzL2NhbmFkYS9uaGwtZ2FtZXMtYnJvYWRjYXN0cy1iZXR0aW5nLWdhbWJsaW5nLXByb21vdGlvbi0xLjY2NjI0NjHSAQA?oc=5
Conservative leadership contender Poilievre calls Europe's ... - CBC.ca,2022-03-01 08:00:00,https://news.google.com/__i/rss/rd/articles/CBMiT2h0dHBzOi8vd3d3LmNiYy5jYS9uZXdzL3BvbGl0aWNzL3BpZXJyZS1wb2lsaWV2cmUtZXUtdWtyYWluZS1yZXNwb25zZS0xLjYzNjg2MjHSAQA?oc=5
"Conservatives to announce new leader on Sept. 10, giving time for ... - CBC.ca",2022-03-02 08:00:00,https://news.google.com/__i/rss/rd/articles/CBMiV2h0dHBzOi8vd3d3LmNiYy5jYS9uZXdzL3BvbGl0aWNzL2NvbnNlcnZhdGl2ZS1wYXJ0eS1sZWFkZXJzaGlwLXJhY2UtZGF0ZS1zZXB0LTEuNjM3MDk3N9IBAA?oc=5
2022 Joan Donaldson CBC News Scholarship recipients - CBC.ca,2022-03-01 08:00:00,https://news.google.com/__i/rss/rd/articles/CBMia2h0dHBzOi8vd3d3LmNiYy5jYS9uZXdzL2pvYW5kb25hbGRzb25zY2hvbGFycy8yMDIyLWpvYW4tZG9uYWxkc29uLWNiYy1uZXdzLXNjaG9sYXJzaGlwLXJlY2lwaWVudHMtMS42MzY4NTkx0gEA?oc=5
Conservative leadership hopeful Pierre Poilievre tables bill to ban ... - CBC News,2022-06-03 07:00:00,https://news.google.com/__i/rss/rd/articles/CBMiT2h0dHBzOi8vd3d3LmNiYy5jYS9uZXdzL3BvbGl0aWNzL3BpZXJyZS1wb2lsaWV2cmUtdmFjY2luZS1tYW5kYXRlLWJhbi0xLjY0NzY0MTnSAQA?oc=5
"Following Poilievre's attacks, Bank of Canada official says it's ... - CBC News",2022-06-03 07:00:00,https://news.google.com/__i/rss/rd/articles/CBMiTWh0dHBzOi8vd3d3LmNiYy5jYS9uZXdzL3BvbGl0aWNzL2Jhbmstb2YtY2FuYWRhLWluZmxhdGlvbi1wb2lsaWV2cmUtMS42NDc1NTE10gEA?oc=5
Conservatives say they're about to set another new membership ... - CBC News,2022-06-03 07:00:00,https://news.google.com/__i/rss/rd/articles/CBMiTmh0dHBzOi8vd3d3LmNiYy5jYS9uZXdzL3BvbGl0aWNzL2NvbnNlcnZhdGl2ZS1sZWFkZXJzaGlwLW1lbWJlcnNoaXBzLTEuNjQ3NTM0NtIBAA?oc=5
The case for making the notwithstanding clause politically awkward ... - CBC News,2022-06-01 07:00:00,https://news.google.com/__i/rss/rd/articles/CBMiXWh0dHBzOi8vd3d3LmNiYy5jYS9uZXdzL3BvbGl0aWNzL2NoYXJ0ZXItcmlnaHRzLW5vdHdpdGhzdGFuZGluZy1jbGF1c2UtY29uc3RpdHV0aW9uLTEuNjQ3MjMxN9IBAA?oc=5
Conservative MP removed from Parliament Hill over vaccination status - CBC News,2022-06-03 07:00:00,https://news.google.com/__i/rss/rd/articles/CBMiSGh0dHBzOi8vd3d3LmNiYy5jYS9uZXdzL3BvbGl0aWNzL2NvbnNlcnZhdGl2ZS1tcC1ob3VzZS1yZW1vdmVkLTEuNjQ3NzEyMNIBAA?oc=5
Tory leadership hopeful Lewis takes aim at 'cancel culture' during St ... - CBC.ca,2022-06-02 07:00:00,https://news.google.com/__i/rss/rd/articles/CBMiVGh0dHBzOi8vd3d3LmNiYy5jYS9uZXdzL2NhbmFkYS9uZXdmb3VuZGxhbmQtbGFicmFkb3IvbGVzbHluLWxld2lzLXN0LWpvaG5zLTEuNjQ3NTA0OdIBAA?oc=5
Facing up to a 'polycrisis' that the Bank of Canada may not have the ... - CBC News,2022-06-03 07:00:00,https://news.google.com/__i/rss/rd/articles/CBMiU2h0dHBzOi8vd3d3LmNiYy5jYS9uZXdzL2J1c2luZXNzL2JhbmstY2FuYWRhLXBvbHljcmlzaXMtY29sdW1uLWRvbi1waXR0aXMtMS42NDc0MTI30gEA?oc=5
Conservatives have big things to fight about — whether they want to or not - CBC.ca,2022-05-12 07:00:00,https://news.google.com/__i/rss/rd/articles/CBMiYGh0dHBzOi8vd3d3LmNiYy5jYS9uZXdzL3BvbGl0aWNzL2NvbnNlcnZhdGl2ZS1kZWJhdGUtcG9pbGlldnJlLWNoYXJlc3Qtd2hlcnJ5LWFuYWx5c2lzLTEuNjQ1MDYxMtIBIGh0dHBzOi8vd3d3LmNiYy5jYS9hbXAvMS42NDUwNjEy?oc=5
Crypto markets tumble and investors get their fingers burned - CBC.ca,2022-05-13 07:00:00,https://news.google.com/__i/rss/rd/articles/CBMiSWh0dHBzOi8vd3d3LmNiYy5jYS9uZXdzL2J1c2luZXNzL2NycHRvLXR1bWJsZS1jb2x1bW4tZG9uLXBpdHRpcy0xLjY0NTA0MTHSAQA?oc=5
Pierre Poilievre is rebranding the Conservative party in his own image - CBC.ca,2022-11-14 08:00:00,https://news.google.com/__i/rss/rd/articles/CBMiWGh0dHBzOi8vd3d3LmNiYy5jYS9uZXdzL3BvbGl0aWNzL3BpZXJyZS1wb2lsaWV2cmUtcmVzaGFwaW5nLWNvbnNlcnZhdGl2ZS1wYXJ0eS0xLjY2NTAyNjPSAQA?oc=5
"As the crypto chaos continues, Liberals remind voters of Poilievre's ... - CBC.ca",2022-11-17 08:00:00,https://news.google.com/__i/rss/rd/articles/CBMiRWh0dHBzOi8vd3d3LmNiYy5jYS9uZXdzL3BvbGl0aWNzL3BvaWxpZXZyZS1jcnlwdG8tZXhwbGFpbmVyLTEuNjY1MzczOdIBAA?oc=5
Canada's own (miniature) midterm election will be in Mississauga ... - CBC.ca,2022-11-13 08:00:00,https://news.google.com/__i/rss/rd/articles/CBMiW2h0dHBzOi8vd3d3LmNiYy5jYS9uZXdzL3BvbGl0aWNzL21pc3Npc3NhdWdhLWxha2VzaG9yZS1ieWVsZWN0aW9uLWFuYWx5c2lzLXdoZXJyeS0xLjY2NDgwNDXSAQA?oc=5
MPs agree to probe allegations of Chinese interference in federal ... - CBC.ca,2022-11-14 08:00:00,https://news.google.com/__i/rss/rd/articles/CBMiU2h0dHBzOi8vd3d3LmNiYy5jYS9uZXdzL3BvbGl0aWNzL21wcy1wcm9iZS1jaGluZXNlLWludGVyZmVyZW5jZS1lbGVjdGlvbnMtMS42NjUxMTIx0gEA?oc=5
What will the potential name change mean for the B.C. Liberal Party? - CBC.ca,2022-11-15 08:00:00,https://news.google.com/__i/rss/rd/articles/CBMiW2h0dHBzOi8vd3d3LmNiYy5jYS9uZXdzL2NhbmFkYS9icml0aXNoLWNvbHVtYmlhL2JjLXVuaXRlZC1iYy1saWJlcmFscy1uYW1lLWNoYW5nZS0xLjY2NDkyNDnSAQA?oc=5
Stephen Harper says Pierre Poilievre has the best chance to win the ... - CBC.ca,2022-07-26 07:00:00,https://news.google.com/__i/rss/rd/articles/CBMiR2h0dHBzOi8vd3d3LmNiYy5jYS9uZXdzL3BvbGl0aWNzL2hhcnBlci1wb2lsaWV2cmUtZW5kb3JzZW1lbnQtMS42NTMxOTk10gEA?oc=5
"Poilievre, Lewis officially out of third Conservative debate - CBC.ca",2022-07-28 07:00:00,https://news.google.com/__i/rss/rd/articles/CBMiYGh0dHBzOi8vd3d3LmNiYy5jYS9uZXdzL3BvbGl0aWNzL3BvaWxpZXZyZS1sZXNseW4tbGV3aXMtY29uc2VydmF0aXZlLWxlYWRlcnNoaXAtZGViYXRlLTEuNjUzNTQyMtIBAA?oc=5
Quebec's Conservative party surges in the polls as some of its ... - CBC.ca,2022-07-28 07:00:00,https://news.google.com/__i/rss/rd/articles/CBMikwFodHRwczovL3d3dy5jYmMuY2EvbmV3cy9pbnZlc3RpZ2F0ZXMvcXVlYmVjLXMtY29uc2VydmF0aXZlLXBhcnR5LXN1cmdlcy1pbi10aGUtcG9sbHMtYXMtc29tZS1vZi1pdHMtY2FuZGlkYXRlcy1zcHJlYWQtY29uc3BpcmFjeS10aGVvcmllcy0xLjY1MzI0ODbSAQA?oc=5
Conservative Party explains why it disqualified Patrick Brown from ... - CBC.ca,2022-07-23 07:00:00,https://news.google.com/__i/rss/rd/articles/CBMiVmh0dHBzOi8vd3d3LmNiYy5jYS9uZXdzL3BvbGl0aWNzL2NvbnNlcnZhdGl2ZS1wYXRyaWNrLWJyb3duLWRpc3F1YWxpZmljYXRpb24tMS42NTI5OTIw0gEA?oc=5
The cost of living can't quite obscure the cost of climate change - CBC.ca,2022-07-23 07:00:00,https://news.google.com/__i/rss/rd/articles/CBMiX2h0dHBzOi8vd3d3LmNiYy5jYS9uZXdzL3BvbGl0aWNzL2NsaW1hdGUtaW5mbGF0aW9uLWZyZWVsYW5kLXBvaWxpZXZyZS13aGVycnktYW5hbHlzaXMtMS42NTI5MTI10gEA?oc=5
U.S. tax credit could rev up electric vehicle production in Canada - CBC.ca,2022-07-28 07:00:00,https://news.google.com/__i/rss/rd/articles/CBMiTWh0dHBzOi8vd3d3LmNiYy5jYS9uZXdzL2J1c2luZXNzL2VsZWN0cmljLXZlaGljbGUtdGF4LWNyZWRpdC1jYW5hZGEtMS42NTM0ODMy0gEA?oc=5
Charest promises to permit more private health services as Poilievre ... - CBC.ca,2022-04-21 07:00:00,https://news.google.com/__i/rss/rd/articles/CBMiW2h0dHBzOi8vd3d3LmNiYy5jYS9uZXdzL3BvbGl0aWNzL2NoYXJlc3QtcG9pbGlldnJlLWhlYWx0aC1jb25zZXJ2YXRpdmUtbGVhZGVyc2hpcC0xLjY0MjYyOTfSAQA?oc=5
"Political rhetoric on inflation is out of touch with reality, experts say - CBC.ca",2022-04-22 07:00:00,https://news.google.com/__i/rss/rd/articles/CBMiQ2h0dHBzOi8vd3d3LmNiYy5jYS9uZXdzL3BvbGl0aWNzL3BvbGl0aWNzLWluZmxhdGlvbi1yaWdodC0xLjY0MjYyMjLSAQA?oc=5
Some Conservatives are condemning a 'truck tax' that doesn't exist - CBC.ca,2022-04-20 07:00:00,https://news.google.com/__i/rss/rd/articles/CBMiW2h0dHBzOi8vd3d3LmNiYy5jYS9uZXdzL3BvbGl0aWNzL2NvbnNlcnZhdGl2ZS10cnVjay10YXgtYnVkZ2V0LWNsaW1hdGUtZ3VpbGJlYXVsdC0xLjY0MjM1MTnSAQA?oc=5
At least 8 Conservatives now officially in the race to lead party - CBC.ca,2022-04-20 07:00:00,https://news.google.com/__i/rss/rd/articles/CBMiVGh0dHBzOi8vd3d3LmNiYy5jYS9uZXdzL3BvbGl0aWNzL2NvbnNlcnZhdGl2ZS1sZWFkZXJzaGlwLWFwcmlsLTE5LWRlYWRsaW5lLTEuNjQyMzk4MNIBAA?oc=5
Conservative leadership candidate Aitchison says he wants to end ... - CBC.ca,2022-04-20 07:00:00,https://news.google.com/__i/rss/rd/articles/CBMiXmh0dHBzOi8vd3d3LmNiYy5jYS9uZXdzL3BvbGl0aWNzL3N1cHBseS1tYW5hZ2VtZW50LWNvbnNlcnZhdGl2ZS1sZWFkZXJzaGlwLWFpdGNoaXNvbi0xLjY0MjUwMzjSAQA?oc=5
Attacking opponents as socialists and dictators weakens the fabric of ... - CBC.ca,2022-04-21 07:00:00,https://news.google.com/__i/rss/rd/articles/CBMiZWh0dHBzOi8vd3d3LmNiYy5jYS9uZXdzL29waW5pb24vb3Bpbmlvbi13b3Jkcy1zb2NpYWxpc3QtY29tbXVuaXN0LWRpY3RhdG9yLXdlYWtlbi1kZW1vY3JhY3ktMS42NDIzNzk20gEA?oc=5
"Immigrants cry foul after permanent residency cards lost, stuck at ... - CBC.ca",2022-04-20 07:00:00,https://news.google.com/__i/rss/rd/articles/CBMib2h0dHBzOi8vd3d3LmNiYy5jYS9uZXdzL2NhbmFkYS9vdHRhd2EvcGVybWFuZW50LXJlc2lkZW5jeS1waHlzaWNhbC1jYXJkLWRlbGF5LWlyY2MtaW1taWdyYXRpb24tY2FuYWRhLTEuNjQxNTk3MNIBAA?oc=5
Ed Fast says Poilievre supporters tried to 'muzzle' him on monetary ... - CBC.ca,2022-05-19 07:00:00,https://news.google.com/__i/rss/rd/articles/CBMiTGh0dHBzOi8vd3d3LmNiYy5jYS9uZXdzL3BvbGl0aWNzL2VkLWZhc3QtZmluYW5jZS1jcml0aWMtc3RlcHMtZG93bi0xLjY0NTg2NznSAQA?oc=5
Poilievre makes his pitch as federal Conservative leadership candidate in St. John's - CBC.ca,2022-05-17 07:00:00,https://news.google.com/__i/rss/rd/articles/CBMiXWh0dHBzOi8vd3d3LmNiYy5jYS9uZXdzL2NhbmFkYS9uZXdmb3VuZGxhbmQtbGFicmFkb3IvcGllcnJlLXBvaWxpZXZyZS1zdGpvaG5zLXJhbGx5LTEuNjQ1NTk5NtIBIGh0dHBzOi8vd3d3LmNiYy5jYS9hbXAvMS42NDU1OTk2?oc=5
"Conservatives condemn racist conspiracy theory, attack each other ... - CBC.ca",2022-05-16 07:00:00,https://news.google.com/__i/rss/rd/articles/CBMiUWh0dHBzOi8vd3d3LmNiYy5jYS9uZXdzL3BvbGl0aWNzL2NvbnNlcnZhdGl2ZXMtcmFjaXN0LWNvbnNwaXJhY3ktdGhlb3J5LTEuNjQ1NTQ3MdIBAA?oc=5
Conservative Party investigating racist email sent to Brown campaign - CBC.ca,2022-05-19 07:00:00,https://news.google.com/__i/rss/rd/articles/CBMiWGh0dHBzOi8vd3d3LmNiYy5jYS9uZXdzL3BvbGl0aWNzL3JhY2lzdC1lbWFpbC1jb25zZXJ2YXRpdmUtbGVhZGVyc2hpcC1jYW1wYWlnbi0xLjY0NTg0NDPSAQA?oc=5
"With Kenney's exit, the 'resistance' era is over — but something ... - CBC.ca",2022-05-20 07:00:00,https://news.google.com/__i/rss/rd/articles/CBMiTGh0dHBzOi8vd3d3LmNiYy5jYS9uZXdzL3BvbGl0aWNzL2phc29uLWtlbm5leS10cnVkZWF1LWNvbnNlcnZhdGl2ZS0xLjY0NTk5NTDSAQA?oc=5
