titles,pubDates,links
Centre Ice Conservatives are warming the bench for now - CBC.ca,2022-08-13 07:00:00,https://news.google.com/__i/rss/rd/articles/CBMiXWh0dHBzOi8vd3d3LmNiYy5jYS9uZXdzL3BvbGl0aWNzL2NlbnRyZS1pY2UtY29uc2VydmF0aXZlcy1wb2lsaWV2cmUtYW5hbHlzaXMtd2hlcnJ5LTEuNjU0OTk1M9IBAA?oc=5
What you need to know about Canada's divisive ArriveCAN app - CBC.ca,2022-08-14 07:00:00,https://news.google.com/__i/rss/rd/articles/CBMiWmh0dHBzOi8vd3d3LmNiYy5jYS9uZXdzL3BvbGl0aWNzL290dGF3YS1hcnJpdmVjYW4tY3JpdGljaXNtcy1haXJwb3J0cy13YWl0LXRpbWVzLTEuNjU0ODUwNNIBAA?oc=5
Conservatives are in a mood to fight — with each other - CBC.ca,2022-05-06 07:00:00,https://news.google.com/__i/rss/rd/articles/CBMiVGh0dHBzOi8vd3d3LmNiYy5jYS9uZXdzL3BvbGl0aWNzL2NvbnNlcnZhdGl2ZS1wb2lsaWV2cmUtY2hhcmVzdC1sZWFkZXJzaGlwLTEuNjQ0NDI2NdIBAA?oc=5
Canadian Conservatives reluctant to comment on report that U.S. ... - CBC.ca,2022-05-03 07:00:00,https://news.google.com/__i/rss/rd/articles/CBMiWGh0dHBzOi8vd3d3LmNiYy5jYS9uZXdzL3BvbGl0aWNzL2NhbmFkaWFuLWNvbnNlcnZhdGl2ZXMtc3VwcmVtZS1jb3VydC1yb2Utd2FkZS0xLjY0Mzk2NjDSAQA?oc=5
Anti-abortion activists claim corruption after Tories bar social ... - CBC.ca,2022-05-02 07:00:00,https://news.google.com/__i/rss/rd/articles/CBMiW2h0dHBzOi8vd3d3LmNiYy5jYS9uZXdzL3BvbGl0aWNzL2NvbnNlcnZhdGl2ZS1sZWFkZXJzaGlwLXJhY2Utc29jaWFsLWNvbnNlcnZhdGl2ZS0xLjY0MzgyNTfSAQA?oc=5
The fate of Roe v. Wade puts both Liberals and Conservatives on ... - CBC.ca,2022-05-05 07:00:00,https://news.google.com/__i/rss/rd/articles/CBMiUWh0dHBzOi8vd3d3LmNiYy5jYS9uZXdzL3BvbGl0aWNzL3JvZS13YWRlLWFib3J0aW9uLXN1cHJlbWUtY291cnQtY2FuYWRhLTEuNjQ0MTY1NNIBAA?oc=5
Charest pledges to boost supply as Conservative leadership rivals ... - CBC.ca,2022-05-04 07:00:00,https://news.google.com/__i/rss/rd/articles/CBMiTWh0dHBzOi8vd3d3LmNiYy5jYS9uZXdzL3BvbGl0aWNzL2NoYXJlc3QtY29uc2VydmF0aXZlLWhvdXNpbmctcGxhbnMtMS42NDQwMzQy0gEA?oc=5
Why Ottawa's plan to ramp up construction might not bring down ... - CBC.ca,2022-05-01 07:00:00,https://news.google.com/__i/rss/rd/articles/CBMiRWh0dHBzOi8vd3d3LmNiYy5jYS9uZXdzL3BvbGl0aWNzL2hvdXNpbmctc3VwcGx5LWhvbWUtcHJpY2VzLTEuNjQzNDU2NNIBAA?oc=5
Rejected Conservative leadership candidate demands to know why ... - CBC.ca,2022-05-04 07:00:00,https://news.google.com/__i/rss/rd/articles/CBMiVWh0dHBzOi8vd3d3LmNiYy5jYS9uZXdzL3BvbGl0aWNzL2ZhaWxlZC1jb25zZXJ2YXRpdmUtY2FuZGlkYXRlLWpvZWwtZXRpZW5uZS0xLjY0NDEyNjLSAQA?oc=5
"As House of Commons begins its winter break, parties outline key ... - CBC.ca",2022-12-14 08:00:00,https://news.google.com/__i/rss/rd/articles/CBMiUmh0dHBzOi8vd3d3LmNiYy5jYS9uZXdzL3BvbGl0aWNzL3BpZXJyZS1wb2lsaWV2cmUtY2F1Y3VzLWhvbGlkYXktYWRkcmVzcy0xLjY2ODUzMTjSAQA?oc=5
Liberals and Conservatives wrestle over the legacy of pandemic ... - CBC.ca,2022-12-11 08:00:00,https://news.google.com/__i/rss/rd/articles/CBMiXGh0dHBzOi8vd3d3LmNiYy5jYS9uZXdzL3BvbGl0aWNzL2F1ZGl0b3ItZ2VuZXJhbC1wYW5kZW1pYy1zcGVuZGluZy1hbmFseXNpcy13aGVycnktMS42NjgwNDEw0gEA?oc=5
Liberal Charles Sousa wins federal byelection in Mississauga ... - CBC.ca,2022-12-13 08:00:00,https://news.google.com/__i/rss/rd/articles/CBMiYGh0dHBzOi8vd3d3LmNiYy5jYS9uZXdzL2NhbmFkYS90b3JvbnRvL2J5ZWxlY3Rpb24tbWlzc2lzc2F1Z2EtbGFrZXNob3JlLXNvdXNhLWNoaGluemVyLTEuNjY4MjgwM9IBAA?oc=5
Trade minister apologizes for breaking conflict of interest rules - CBC.ca,2022-12-14 08:00:00,https://news.google.com/__i/rss/rd/articles/CBMiTmh0dHBzOi8vd3d3LmNiYy5jYS9uZXdzL3BvbGl0aWNzL3RyYWRlLW1pbmlzdGVyLWNvbmZsaWN0LW9mLWludGVyZXN0LTEuNjY4NDAyNdIBAA?oc=5
"To let Smith be Smith, or not to let Smith be Smith? That is the UCP ... - CBC.ca",2022-12-10 08:00:00,https://news.google.com/__i/rss/rd/articles/CBMiYGh0dHBzOi8vd3d3LmNiYy5jYS9uZXdzL2NhbmFkYS9jYWxnYXJ5L2FsYmVydGEtcHJlbWllci1kYW5pZWxsZS1zbWl0aC1oZXJzZWxmLWlkZW50aXR5LTEuNjY4MTI0NdIBAA?oc=5
Health authorities won't reveal number of emergency waiting room ... - CBC.ca,2022-12-14 08:00:00,https://news.google.com/__i/rss/rd/articles/CBMiXWh0dHBzOi8vd3d3LmNiYy5jYS9uZXdzL2NhbmFkYS9uZXctYnJ1bnN3aWNrL2hlYWx0aC1hdXRob3JpdGllcy13YWl0aW5nLXJvb20tZGVhdGhzLTEuNjY4NTc1MdIBAA?oc=5
Poilievre blasted during Commons debate on cryptocurrency ... - CBC News,2022-11-21 08:00:00,https://news.google.com/__i/rss/rd/articles/CBMiV2h0dHBzOi8vd3d3LmNiYy5jYS9uZXdzL3BvbGl0aWNzL3BvaWxpZXZyZS1ibGFzdGVkLWNyeXB0b2N1cnJlbmN5LWxlZ2lzbGF0aW9uLTEuNjY1OTA1MtIBAA?oc=5
Inflation relief measures should be well targeted and temporary ... - CBC.ca,2022-11-23 08:00:00,https://news.google.com/__i/rss/rd/articles/CBMiUWh0dHBzOi8vd3d3LmNiYy5jYS9uZXdzL3BvbGl0aWNzL3RpZmYtbWFja2xlbS10YXJnZXRlZC1pbmZsYXRpb24tcmVsaWVmLTEuNjY2MjQyNdIBAA?oc=5
Poilievre's supporters push for a swift race to choose next ... - CBC.ca,2022-02-25 08:00:00,https://news.google.com/__i/rss/rd/articles/CBMiR2h0dHBzOi8vd3d3LmNiYy5jYS9uZXdzL3BvbGl0aWNzL3BvaWxpZXZyZS1jb25zZXJ2YXRpdmUtcGFydHktMS42MzYzMjgz0gEA?oc=5
Emergencies Act passes crucial House of Commons vote with NDP ... - CBC.ca,2022-02-22 08:00:00,https://news.google.com/__i/rss/rd/articles/CBMiR2h0dHBzOi8vd3d3LmNiYy5jYS9uZXdzL3BvbGl0aWNzL3RydWRlYXUtZW1lcmdlbmNpZXMtYWN0LXZvdGUtMS42MzU5MjQz0gEA?oc=5
Jean Charest considering Conservative leadership run: sources - CBC.ca,2022-02-22 08:00:00,https://news.google.com/__i/rss/rd/articles/CBMiU2h0dHBzOi8vd3d3LmNiYy5jYS9uZXdzL3BvbGl0aWNzL2plYW4tY2hhcmVzdC1jb25zZXJ2YXRpdmUtbGVhZGVyc2hpcC1ydW4tMS42MzYwMDMy0gEA?oc=5
Populist rage demands leaders who listen — and choose their ... - CBC.ca,2022-02-23 08:00:00,https://news.google.com/__i/rss/rd/articles/CBMiU2h0dHBzOi8vd3d3LmNiYy5jYS9uZXdzL3BvbGl0aWNzL2NvbnZveS12YWNjaW5lLXBhbmRlbWljLXRydWRlYXUtcG9wdWxpc20tMS42MzYwNTE50gEA?oc=5
Poilievre delivers speech to a group criticized for residential school ... - CBC.ca,2023-01-13 23:59:24,https://news.google.com/__i/rss/rd/articles/CBMiWGh0dHBzOi8vd3d3LmNiYy5jYS9uZXdzL3BvbGl0aWNzL3BvaWxpZXZyZS1mcm9udGllci1jZW50cmUtcmVzaWRlbnRpYWwtc2Nob29scy0xLjY3MTM0MTnSAQA?oc=5
"Provincial Tories aim to get closer to federal Conservatives, says ... - CBC.ca",2023-01-13 17:30:00,https://news.google.com/__i/rss/rd/articles/CBMiW2h0dHBzOi8vd3d3LmNiYy5jYS9uZXdzL2NhbmFkYS9uZXdmb3VuZGxhbmQtbGFicmFkb3IvZGF2aWQtYnJhemlsLTIwMjMtbG9vay1haGVhZC0xLjY3MTE5MzfSAQA?oc=5
Poilievre calls for parliamentary probe of Liberals' relationship with ... - CBC.ca,2023-01-10 18:07:00,https://news.google.com/__i/rss/rd/articles/CBMiUWh0dHBzOi8vd3d3LmNiYy5jYS9uZXdzL3BvbGl0aWNzL21ja2luc2V5LWNvbnRyYWN0cy1wb2lsaWV2cmUtcXVlc3Rpb25zLTEuNjcwOTAzNtIBAA?oc=5
Why Jordan Peterson is refusing an order to take training for his ... - CBC.ca,2023-01-13 14:19:00,https://news.google.com/__i/rss/rd/articles/CBMiXWh0dHBzOi8vd3d3LmNiYy5jYS9uZXdzL2NhbmFkYS90b3JvbnRvL2pvcmRhbi1wZXRlcnNvbi1jb2xsZWdlLXBzeWNob2xvZ2lzdHMtdHdlZXRzLTEuNjcxMTUyNNIBAA?oc=5
Calgarians gather to remember victims 3 years after Flight PS752 shot down - CBC.ca,2023-01-09 13:44:57,https://news.google.com/__i/rss/rd/articles/CBMiSmh0dHBzOi8vd3d3LmNiYy5jYS9uZXdzL2NhbmFkYS9jYWxnYXJ5L2lyYW4tY2FuYWRhLWNhbGdhcnktcHM3NTItMS42NzA3NTE30gEgaHR0cHM6Ly93d3cuY2JjLmNhL2FtcC8xLjY3MDc1MTc?oc=5
2 Conservative MPs switch allegiance from Patrick Brown to Pierre ... - CBC.ca,2022-06-08 07:00:00,https://news.google.com/__i/rss/rd/articles/CBMiQ2h0dHBzOi8vd3d3LmNiYy5jYS9uZXdzL3BvbGl0aWNzL3R3by1tcHMtZGVmZWN0LXBvaWxpZXZyZS0xLjY0ODAzMzjSAQA?oc=5
"Following Poilievre's attacks, Bank of Canada governor says he ... - CBC.ca",2022-06-09 07:00:00,https://news.google.com/__i/rss/rd/articles/CBMiVWh0dHBzOi8vd3d3LmNiYy5jYS9uZXdzL3BvbGl0aWNzL3BvaWxpZXZyZS1hdHRhY2tzLWJhbmstb2YtY2FuYWRhLWNyaXRpY2lzbS0xLjY0ODI5NzbSAQA?oc=5
"Over 600,000 CPC members expected to be eligible to decide ... - CBC.ca",2022-06-06 07:00:00,https://news.google.com/__i/rss/rd/articles/CBMiSmh0dHBzOi8vd3d3LmNiYy5jYS9uZXdzL3BvbGl0aWNzL2NwYy1sZWFkZXJzaGlwLW1lbWJlcnNoaXAtc2FsZXMtMS42NDc3ODE50gEA?oc=5
What the federal Tories can learn from Doug Ford's big Ontario win - CBC.ca,2022-06-06 07:00:00,https://news.google.com/__i/rss/rd/articles/CBMiSmh0dHBzOi8vd3d3LmNiYy5jYS9uZXdzL3BvbGl0aWNzL2ZlZGVyYWwtY29uc2VydmF0aXZlcy1kb3VnLWZvcmQtMS42NDc2NTQ00gEA?oc=5
Newest homebuyers could pay the price for Canada's financial stability - CBC.ca,2022-06-10 07:00:00,https://news.google.com/__i/rss/rd/articles/CBMiVGh0dHBzOi8vd3d3LmNiYy5jYS9uZXdzL2J1c2luZXNzL2NhbmFkYS1maW5hbmNpYWwtc3lzdGVtLWNvbHVtbi1kb24tcGl0dGlzLTEuNjQ4MTQ5NtIBAA?oc=5
"The ballad of Bill Morneau — a call for more economic growth, less ... - CBC.ca",2022-06-04 07:00:00,https://news.google.com/__i/rss/rd/articles/CBMiVmh0dHBzOi8vd3d3LmNiYy5jYS9uZXdzL3BvbGl0aWNzL2JpbGwtbW9ybmVhdS1zcGVlY2gtdHJ1ZGVhdS13aGVycnktYW5hbHlzaXMtMS42NDc3MjYw0gEA?oc=5
Chief justice warns against political attacks on judicial independence - CBC.ca,2022-06-05 07:00:00,https://news.google.com/__i/rss/rd/articles/CBMiXWh0dHBzOi8vd3d3LmNiYy5jYS9uZXdzL3BvbGl0aWNzL2p1ZGljaWFsLWluZGVwZW5kZW5jZS1zdXByZW1lLWNvdXJ0LXJpY2hhcmQtd2FnbmVyLTEuNjQ3Mzc1NNIBAA?oc=5
The forced labour filling our closets: U.S. is coming after it in an ... - CBC.ca,2022-06-06 07:00:00,https://news.google.com/__i/rss/rd/articles/CBMiPWh0dHBzOi8vd3d3LmNiYy5jYS9uZXdzL3dvcmxkL2ZvcmNlZC1sYWJvdXItbmV3LWxhdy0xLjY0NzU3MzjSAQA?oc=5
Poilievre pitches a 'pay-as-you-go' law to rein in federal spending - CBC.ca,2022-06-22 07:00:00,https://news.google.com/__i/rss/rd/articles/CBMiTGh0dHBzOi8vd3d3LmNiYy5jYS9uZXdzL3BvbGl0aWNzL3BvaWxpZXZyZS1wYXktYXMteW91LWdvLWJ1ZGdldGluZy0xLjY0OTc2NTLSAQA?oc=5
Trudeau calls U.S. court decision overturning Roe v. Wade 'horrific' - CBC.ca,2022-06-24 07:00:00,https://news.google.com/__i/rss/rd/articles/CBMiTWh0dHBzOi8vd3d3LmNiYy5jYS9uZXdzL3BvbGl0aWNzL3RydWRlYXUtaG9ycmlmaWMtdXMtY291cnQtYWJvcnRpb24tMS42NTAwNDc10gEA?oc=5
The Liberals face a summer of discontent - CBC.ca,2022-06-19 07:00:00,https://news.google.com/__i/rss/rd/articles/CBMiYWh0dHBzOi8vd3d3LmNiYy5jYS9uZXdzL3BvbGl0aWNzL21pbm9yaXR5LXJlcG9ydC1saWJlcmFscy1mcmVlbGFuZC1pbmZsYXRpb24tcGFybGlhbWVudC0xLjY0OTIyMTjSAQA?oc=5
Patrick Brown's campaign manager joins Michelle Rempel Garner ... - CBC.ca,2022-06-22 07:00:00,https://news.google.com/__i/rss/rd/articles/CBMiW2h0dHBzOi8vd3d3LmNiYy5jYS9uZXdzL2NhbmFkYS9jYWxnYXJ5L3BhdHJpY2stYnJvd24tcmVtcGVsLWdhcm5lci11Y3AtbGVhZGVyc2hpcC0xLjY0OTgwNTTSAQA?oc=5
Higher oil and gas prices may be permanent: former Bank of ... - CBC.ca,2022-06-23 07:00:00,https://news.google.com/__i/rss/rd/articles/CBMiSWh0dHBzOi8vd3d3LmNiYy5jYS9uZXdzL3BvbGl0aWNzL3BvbG96LWdhcy1vaWwtcHJpY2VzLWluZmxhdGlvbi0xLjY0OTgwMTXSAQA?oc=5
Federal government scrambles to address hordes of passport ... - CBC.ca,2022-06-23 07:00:00,https://news.google.com/__i/rss/rd/articles/CBMiTGh0dHBzOi8vd3d3LmNiYy5jYS9uZXdzL3BvbGl0aWNzL2ZlZGVyYWwtZ292ZXJubWVudC1wYXNzcG9ydC1jaGFvcy0xLjY0OTk0NTjSAQA?oc=5
"Alberta embraced the cryptocurrency sector. Months later, crypto ... - CBC.ca",2022-06-21 07:00:00,https://news.google.com/__i/rss/rd/articles/CBMiW2h0dHBzOi8vd3d3LmNiYy5jYS9uZXdzL2NhbmFkYS9jYWxnYXJ5L2FsYmVydGEtY3J5cHRvY3VycmVuY3ktYmxvY2tjaGFpbi1jb2xsYXBzZS0xLjY0OTUzMjbSAQA?oc=5
"While Poilievre mocks, his Conservative leadership rivals offer a few ... - CBC.ca",2022-08-04 07:00:00,https://news.google.com/__i/rss/rd/articles/CBMiYGh0dHBzOi8vd3d3LmNiYy5jYS9uZXdzL3BvbGl0aWNzL3BvaWxpZXZyZS1jaGFyZXN0LWNvbnNlcnZhdGl2ZS1kZWJhdGUtYW5hbHlzaXMtd2hlcnJ5LTEuNjU0MDk4NdIBAA?oc=5
"Federal Conservative leadership hopeful Poilievre targets elites, big ... - CBC.ca",2022-08-04 07:00:00,https://news.google.com/__i/rss/rd/articles/CBMiTGh0dHBzOi8vd3d3LmNiYy5jYS9uZXdzL2NhbmFkYS9tYW5pdG9iYS9wb2lsaWV2cmUtZWxlY3Rpb24tYnJhbmRvbi0xLjY1NDE4MDPSAQA?oc=5
Quebec senator leaving Conservative caucus but says he will ... - CBC.ca,2022-08-04 07:00:00,https://news.google.com/__i/rss/rd/articles/CBMiWWh0dHBzOi8vd3d3LmNiYy5jYS9uZXdzL3BvbGl0aWNzL3NlbmF0b3ItbGFycnktc21pdGgtbGVhdmVzLWNvbnNlcnZhdGl2ZS1jYXVjdXMtMS42NTQxNDMx0gEA?oc=5
Trudeau wants Alberta to spend budget surplus on carbon capture ... - CBC.ca,2023-01-06 08:00:00,https://news.google.com/__i/rss/rd/articles/CBMifGh0dHBzOi8vd3d3LmNiYy5jYS9uZXdzL2NhbmFkYS9lZG1vbnRvbi90cnVkZWF1LXdhbnRzLWFsYmVydGEtdG8tc3BlbmQtYnVkZ2V0LXN1cnBsdXMtb24tY2FyYm9uLWNhcHR1cmUtaW5jZW50aXZlcy0xLjY3MDY1MzHSAQA?oc=5
Next Bank of Canada governor would stay focused on fighting inflation: Poilievre - CBC News,2022-12-31 08:00:00,https://news.google.com/__i/rss/rd/articles/CBMiTWh0dHBzOi8vd3d3LmNiYy5jYS9uZXdzL3BvbGl0aWNzL3BvaWxpZXZyZS1pbmZsYXRpb24tYmFuay1vZi1jYW5hZGEtMS42NzAwNjkx0gEgaHR0cHM6Ly93d3cuY2JjLmNhL2FtcC8xLjY3MDA2OTE?oc=5
Funeral for slain OPP officer Grzegorz Pierzchala is Wednesday ... - CBC.ca,2023-01-02 08:00:00,https://news.google.com/__i/rss/rd/articles/CBMihgFodHRwczovL3d3dy5jYmMuY2EvbmV3cy9jYW5hZGEvaGFtaWx0b24vZnVuZXJhbC1mb3Itc2xhaW4taGFsZGltYW5kLW9wcC1vZmZpY2VyLXNldC1mb3Itd2VkbmVzZGF5LWFzLWludmVzdGlnYXRpb24tY29udGludWVzLTEuNjcwMTUwNtIBAA?oc=5
Chrystia Freeland details $8.9B in measures to tackle affordability in ... - CBC.ca,2022-06-16 07:00:00,https://news.google.com/__i/rss/rd/articles/CBMiU2h0dHBzOi8vd3d3LmNiYy5jYS9uZXdzL3BvbGl0aWNzL2NocnlzdGlhLWZyZWVsYW5kLW1ham9yLWluZmxhdGlvbi1zcGVlY2gtMS42NDkwMzEy0gEA?oc=5
Canada's inflation rate rises to new 30-year high of 4.8% - CBC.ca,2022-01-19 08:00:00,https://news.google.com/__i/rss/rd/articles/CBMiO2h0dHBzOi8vd3d3LmNiYy5jYS9uZXdzL2J1c2luZXNzL2luZmxhdGlvbi1jYW5hZGEtMS42MzIwMDg10gEA?oc=5
"Jagmeet Singh and his wife have 'realized their error,' will pay for ... - CBC.ca",2022-01-19 08:00:00,https://news.google.com/__i/rss/rd/articles/CBMiTWh0dHBzOi8vd3d3LmNiYy5jYS9uZXdzL3BvbGl0aWNzL2phZ21lZXQtc2luZ2gtY2hhaXItZ2lmdC1yZWltYnVyc2UtMS42MzE5NzA00gEA?oc=5
Alberta Premier Danielle Smith says she distrusts World Economic ... - CBC.ca,2022-10-26 07:00:00,https://news.google.com/__i/rss/rd/articles/CBMiYGh0dHBzOi8vd3d3LmNiYy5jYS9uZXdzL2NhbmFkYS9jYWxnYXJ5L3VjcC13b3JsZC1lY29ub21pYy1mb3J1bS1zbWl0aC1lZG1vbnRvbi1jYWxnYXJ5LTEuNjYyODI5NNIBAA?oc=5
What the Liberals and Conservatives get right — and wrong ... - CBC.ca,2022-10-23 07:00:00,https://news.google.com/__i/rss/rd/articles/CBMiUWh0dHBzOi8vd3d3LmNiYy5jYS9uZXdzL3BvbGl0aWNzL2hvdXNlLW9mLWNvbW1vbnMtcGJvLXJlcG9ydC1jYXJib24tdGF4LTEuNjYyNTYxMtIBAA?oc=5
RCMP running short of officers to protect cabinet ministers from a ... - CBC.ca,2022-10-27 07:00:00,https://news.google.com/__i/rss/rd/articles/CBMibWh0dHBzOi8vd3d3LmNiYy5jYS9uZXdzL3BvbGl0aWNzL3JjbXAtY2xvc2UtcHJvdGVjdGlvbi11bml0LXNob3J0YWdlLWNhYmluZXQtcHJpbWUtbWluaXN0ZXItdGhyZWF0cy0xLjY2MjkwOTLSAQA?oc=5
"More Canadians are turning to food banks than ever before, new ... - CBC.ca",2022-10-27 07:00:00,https://news.google.com/__i/rss/rd/articles/CBMiP2h0dHBzOi8vd3d3LmNiYy5jYS9uZXdzL2NhbmFkYS9mb29kLWJhbmstY2FuYWRhLXVzYWdlLTEuNjYzMTEyMNIBAA?oc=5
N.L. Liberal MP votes with Conservatives over home heating fuel ... - CBC.ca,2022-10-25 07:00:00,https://news.google.com/__i/rss/rd/articles/CBMibWh0dHBzOi8vd3d3LmNiYy5jYS9uZXdzL2NhbmFkYS9uZXdmb3VuZGxhbmQtbGFicmFkb3Iva2VuLW1jZG9uYWxkLWNhcmJvbi10YXgtZXhlbXB0aW9uLWhvbWUtaGVhdGluZy0xLjY2Mjg0NjDSAQA?oc=5
"Canada not immune from faltering global growth, says IMF chief ... - CBC.ca",2022-10-23 07:00:00,https://news.google.com/__i/rss/rd/articles/CBMiOWh0dHBzOi8vd3d3LmNiYy5jYS9uZXdzL3BvbGl0aWNzL2NhbmFkYS1lY29ub215LTEuNjYyNjY3NdIBAA?oc=5
P.E.I. has been put through the wringer. Now there's a crucial ... - CBC.ca,2022-10-29 07:00:00,https://news.google.com/__i/rss/rd/articles/CBMiWWh0dHBzOi8vd3d3LmNiYy5jYS9uZXdzL2NhbmFkYS9wcmluY2UtZWR3YXJkLWlzbGFuZC9wZWktbXVuaWNpcGFsLWVsZWN0aW9uLTIwMjItMS42NjI0OTgy0gEA?oc=5
Disqualified NDP leadership hopeful calls on B.C. to declare climate ... - CBC.ca,2022-10-23 07:00:00,https://news.google.com/__i/rss/rd/articles/CBMiX2h0dHBzOi8vd3d3LmNiYy5jYS9uZXdzL2NhbmFkYS9icml0aXNoLWNvbHVtYmlhL2FuamFsaS1hcHBhZHVyYWktYmMtY2xpbWF0ZS1lbWVyZ2VuY3ktMS42NjI2NzM00gEA?oc=5
Opposition attempts to hit reset on N.S. carbon pricing bill - CBC.ca,2022-10-24 07:00:00,https://news.google.com/__i/rss/rd/articles/CBMibWh0dHBzOi8vd3d3LmNiYy5jYS9uZXdzL2NhbmFkYS9ub3ZhLXNjb3RpYS9vcHBvc2l0aW9uLWF0dGVtcHRzLXJlc2V0LWdvdmVybm1lbnQtY2FyYm9uLXByaWNpbmctYmlsbC0xLjY2MjcyODnSASBodHRwczovL3d3dy5jYmMuY2EvYW1wLzEuNjYyNzI4OQ?oc=5
Charest has the edge in Ontario over Conservative leadership rival ... - CBC.ca,2022-03-23 07:00:00,https://news.google.com/__i/rss/rd/articles/CBMiV2h0dHBzOi8vd3d3LmNiYy5jYS9uZXdzL3BvbGl0aWNzL2FuZ3VzLXJlaWQtcG9sbC1jb25zZXJ2YXRpdmUtbGVhZGVyc2hpcC1yYWNlLTEuNjM5MjY3NNIBAA?oc=5
"Poilievre vows to ban oil from 'polluting dictatorships,' double ... - CBC.ca",2022-03-25 07:00:00,https://news.google.com/__i/rss/rd/articles/CBMiRGh0dHBzOi8vd3d3LmNiYy5jYS9uZXdzL3BvbGl0aWNzL3BvaWxpZXZyZS1mb3JlaWduLW9pbC1iYW4tMS42Mzk3NDAy0gEA?oc=5
Conservative interim leader accuses Liberals of 'power grab' after ... - CBC.ca,2022-03-22 07:00:00,https://news.google.com/__i/rss/rd/articles/CBMiWWh0dHBzOi8vd3d3LmNiYy5jYS9uZXdzL3BvbGl0aWNzL2NvbnNlcnZhdGl2ZXMtc2xhbS1saWJlcmFsLXBvd2VyLWdyYWItbmRwLXBhY3QtMS42MzkzMjA10gEA?oc=5
Poilievre's campaign hires team behind Canada Proud to boost his ... - CBC.ca,2022-04-28 07:00:00,https://news.google.com/__i/rss/rd/articles/CBMiZGh0dHBzOi8vd3d3LmNiYy5jYS9uZXdzL3BvbGl0aWNzL3BvaWxpZXZyZS1iYWxsaW5nYWxsLWNvbnNlcnZhdGl2ZS1sZWFkZXJzaGlwLWNhbmFkYS1wcm91ZC0xLjY0MzMwODjSAQA?oc=5
Pierre Poilievre promises to quash Bank of Canada's foray into ... - CBC.ca,2022-04-29 07:00:00,https://news.google.com/__i/rss/rd/articles/CBMiSWh0dHBzOi8vd3d3LmNiYy5jYS9uZXdzL3BvbGl0aWNzL3BvaWxpZXZyZS1iYW5rLW9mLWNhbmFkYS1hdWRpdC0xLjY0MzM4NjDSAQA?oc=5
Poilievre seems to be tearing a page from Trudeau's 'middle class ... - CBC.ca,2022-04-24 07:00:00,https://news.google.com/__i/rss/rd/articles/CBMiVGh0dHBzOi8vd3d3LmNiYy5jYS9uZXdzL3BvbGl0aWNzL3BvaWxpZXZyZS10cnVkZWF1LWNvbnNlcnZhdGl2ZS1sZWFkZXJzaGlwLTEuNjQyNzYyM9IBAA?oc=5
"As Poilievre's events draw big crowds, Charest says he's focused on ... - CBC.ca",2022-04-23 07:00:00,https://news.google.com/__i/rss/rd/articles/CBMiVGh0dHBzOi8vd3d3LmNiYy5jYS9uZXdzL3BvbGl0aWNzL2NoYXJlc3QtcG9pbGlldnJlLWNvbnNlcnZhdGl2ZS1sZWFkZXJzaGlwLTEuNjQyODMwNdIBAA?oc=5
"Poilievre, Charest call for more pipelines while insisting they can cut ... - CBC.ca",2022-04-26 07:00:00,https://news.google.com/__i/rss/rd/articles/CBMiWmh0dHBzOi8vd3d3LmNiYy5jYS9uZXdzL3BvbGl0aWNzL2NoYXJlc3QtcG9pbGlldnJlLWNsaW1hdGUtZW52aXJvbm1lbnQtZW1pc3Npb25zLTEuNjQzMTU5MtIBAA?oc=5
Preston Manning warns Conservative campaigns that personal ... - CBC.ca,2022-04-28 07:00:00,https://news.google.com/__i/rss/rd/articles/CBMiY2h0dHBzOi8vd3d3LmNiYy5jYS9uZXdzL3BvbGl0aWNzL3ByZXN0b24tbWFubmluZy1jb25zZXJ2YXRpdmUtbGVhZGVyc2hpcC1wZXJzb25hbC1hdHRhY2tzLTEuNjQzNDMzNtIBAA?oc=5
"Charest, Poilievre fight for N.B. support in leadership race - CBC.ca",2022-04-26 07:00:00,https://news.google.com/__i/rss/rd/articles/CBMiW2h0dHBzOi8vd3d3LmNiYy5jYS9uZXdzL2NhbmFkYS9uZXctYnJ1bnN3aWNrL2NoYXJlc3QtcG9pbGlldnJlLWxlYWRlcnNoaXAtcmFjZS1uYi0xLjY0MzAzODbSAQA?oc=5
"Ontario Progressive Conservatives campaigning as if COVID-19 pandemic over, experts say - CBC.ca",2022-04-24 07:00:00,https://news.google.com/__i/rss/rd/articles/CBMiPWh0dHBzOi8vd3d3LmNiYy5jYS9uZXdzL2NhbmFkYS90b3JvbnRvL2VseG4tb250LXBjcy0xLjY0MjkzODXSASBodHRwczovL3d3dy5jYmMuY2EvYW1wLzEuNjQyOTM4NQ?oc=5
B.C. couple on the hook for real estate commission after sale of their ... - CBC.ca,2022-04-28 07:00:00,https://news.google.com/__i/rss/rd/articles/CBMiZGh0dHBzOi8vd3d3LmNiYy5jYS9uZXdzL2NhbmFkYS9icml0aXNoLWNvbHVtYmlhL2JjLWNvbW1pc3Npb24tcmVhbC1lc3RhdGUtbGF3c3VpdC1kZWNpc2lvbi0xLjY0MzMzNzDSAQA?oc=5
Leslyn Lewis latest federal Conservative leadership hopeful to hit N.B. - CBC.ca,2022-04-29 07:00:00,https://news.google.com/__i/rss/rd/articles/CBMiZ2h0dHBzOi8vd3d3LmNiYy5jYS9uZXdzL2NhbmFkYS9uZXctYnJ1bnN3aWNrL2xlc2x5bi1sZXdpcy1jb25zZXJ2YXRpdmUtbGVhZGVyc2hpcC1mcmVkZXJpY3Rvbi0xLjY0MzYxMzLSAQA?oc=5
Government will review RCMP contract awarded to China-linked ... - CBC News,2022-12-07 08:00:00,https://news.google.com/__i/rss/rd/articles/CBMiSmh0dHBzOi8vd3d3LmNiYy5jYS9uZXdzL3BvbGl0aWNzL3JjbXAtY29udHJhY3QtZ292ZXJubWVudC1yZXZpZXctMS42Njc3MTM20gEA?oc=5
"AFN assembly wraps with some progress, 1 show of unity and ... - CBC.ca",2022-12-08 08:00:00,https://news.google.com/__i/rss/rd/articles/CBMiSGh0dHBzOi8vd3d3LmNiYy5jYS9uZXdzL2luZGlnZW5vdXMvYWZuLXNwZWNpYWwtY2hpZWZzLWFzc2VtYmx5LTEuNjY3OTcyMtIBAA?oc=5
PM's national security adviser says she's seen 'no evidence' of ... - CBC.ca,2022-12-09 08:00:00,https://news.google.com/__i/rss/rd/articles/CBMiUmh0dHBzOi8vd3d3LmNiYy5jYS9uZXdzL3BvbGl0aWNzL2pvZHktdGhvbWFzLWNoaW5hLWVsZWN0aW9uLWludGVyZmVyZW5jZS0xLjY2Nzk0NDPSAQA?oc=5
"Federal COVID-19 vaccine, benefits rollout swift but wasteful: AG - CBC.ca",2022-12-06 08:00:00,https://news.google.com/__i/rss/rd/articles/CBMiVWh0dHBzOi8vd3d3LmNiYy5jYS9uZXdzL3BvbGl0aWNzL2F1ZGl0b3ItZ2VuZXJhbC1wYW5kZW1pYy1iZW5lZml0cy12YWNjaW5lcy0xLjY2NzU3MjnSAQA?oc=5
Brown considering a run in Brampton mayoral race if rival Poilievre ... - CBC.ca,2022-06-29 07:00:00,https://news.google.com/__i/rss/rd/articles/CBMiXmh0dHBzOi8vd3d3LmNiYy5jYS9uZXdzL3BvbGl0aWNzL2Jyb3duLWNvbnNlcnZhdGl2ZS1sZWFkZXJzaGlwLXJhY2UtbWF5b3JhbC1lbGVjdGlvbi0xLjY1MDU3MDHSAQA?oc=5
"Number of Conservative members surges: party says 675,000 ... - CBC.ca",2022-07-02 07:00:00,https://news.google.com/__i/rss/rd/articles/CBMiUmh0dHBzOi8vd3d3LmNiYy5jYS9uZXdzL3BvbGl0aWNzL2NvbnNlcnZhdGl2ZS1sZWFkZXJzaGlwLW51bWJlcnMtcHJvdGVzdC0xLjY1MDcyMjHSAQA?oc=5
Police make arrests after anti-vaccine mandate army reservist leads ... - CBC.ca,2022-06-30 07:00:00,https://news.google.com/__i/rss/rd/articles/CBMiT2h0dHBzOi8vd3d3LmNiYy5jYS9uZXdzL2NhbmFkYS9vdHRhd2EvYXJyZXN0cy1kb3dudG93bi1vdHRhd2EtanVuZS0zMC0xLjY1MDgwNDfSAQA?oc=5
Freedom Convoy protesters return for Canada Day - CBC.ca,2022-07-01 07:00:00,https://news.google.com/__i/rss/rd/articles/CBMiY2h0dHBzOi8vd3d3LmNiYy5jYS9uZXdzL2NhbmFkYS9vdHRhd2EvZnJlZWRvbS1jb252b3ktcHJvdGVzdGVycy1jYW5hZGEtZGF5LW90dGF3YS1hcnJpdmFsLTEuNjUwNzg1NdIBAA?oc=5
Danielle Smith's 'sovereignty' plan separates her from UCP ... - CBC.ca,2022-06-25 07:00:00,https://news.google.com/__i/rss/rd/articles/CBMiZWh0dHBzOi8vd3d3LmNiYy5jYS9uZXdzL2NhbmFkYS9jYWxnYXJ5L2RhbmllbGxlLXNtaXRoLXNvdmVyZWlnbnR5LWFjdC11Y3AtbGVhZGVyc2hpcC1kZWJhdGUtMS42NTAxMzE20gEA?oc=5
Conservative leadership event going ahead as planned during ... - CBC.ca,2022-09-09 07:00:00,https://news.google.com/__i/rss/rd/articles/CBMiVGh0dHBzOi8vd3d3LmNiYy5jYS9uZXdzL3BvbGl0aWNzL2NvbnNlcnZhdGl2ZS1sZWFkZXJzaGlwLWV2ZW50LWdvaW5nLWFoZWFkLTEuNjU3NzE2NdIBAA?oc=5
World Economic Forum official says Canada has bigger issues to ... - CBC.ca,2022-09-03 07:00:00,https://news.google.com/__i/rss/rd/articles/CBMiXGh0dHBzOi8vd3d3LmNiYy5jYS9uZXdzL3BvbGl0aWNzL2Fkcmlhbi1tb25jay13b3JsZC1lY29ub21pYy1mb3J1bS1ob3VzZS1pbnRlcnZpZXctMS42NTcxNTY50gEA?oc=5
Interim Conservative Leader Candice Bergen says she's not running ... - CBC.ca,2022-09-06 07:00:00,https://news.google.com/__i/rss/rd/articles/CBMiRWh0dHBzOi8vd3d3LmNiYy5jYS9uZXdzL3BvbGl0aWNzL2NhbmRpY2UtYmVyZ2VuLW5vdC1ydW5uaW5nLTEuNjU3MzM0OdIBAA?oc=5
Conservatives hitch their wagons to the convoy protest without ... - CBC.ca,2022-02-01 08:00:00,https://news.google.com/__i/rss/rd/articles/CBMiX2h0dHBzOi8vd3d3LmNiYy5jYS9uZXdzL3BvbGl0aWNzL3BvaWxpZXZyZS1jb25zZXJ2YXRpdmUtb3Rvb2xlLWNvbnZveS12YWNjaW5lLW1hbmRhdGUtMS42MzM1Mjg20gEA?oc=5
Inflation isn't the main factor driving Canada's sky-high housing ... - CBC.ca,2022-02-02 08:00:00,https://news.google.com/__i/rss/rd/articles/CBMiSmh0dHBzOi8vd3d3LmNiYy5jYS9uZXdzL3BvbGl0aWNzL2hvdXNpbmctaW5mbGF0aW9uLWNvbnNlcnZhdGl2ZXMtMS42MzM1NjMz0gEA?oc=5
The protest convoy carries a combustible load. Politicians can ... - CBC.ca,2022-01-29 08:00:00,https://news.google.com/__i/rss/rd/articles/CBMiWGh0dHBzOi8vd3d3LmNiYy5jYS9uZXdzL3BvbGl0aWNzL3RydWNrZXItZnJlZWRvbS1jb252b3ktdmFjY2luZS1wYW5kZW1pYy1jb3ZpZC0xLjYzMzE5MDjSAQA?oc=5
The latest on the coronavirus outbreak for Feb. 2 - CBC.ca,2022-02-02 08:00:00,https://news.google.com/__i/rss/rd/articles/CBMiSmh0dHBzOi8vd3d3LmNiYy5jYS9uZXdzL2NhbmFkYS9jb3JvbmF2aXJ1cy1uZXdzbGV0dGVyLTIwMjItZmViLTItMS42MzM3MTE50gEgaHR0cHM6Ly93d3cuY2JjLmNhL2FtcC8xLjYzMzcxMTk?oc=5
Trudeau 'has failed to protect our democracy' from China's threats ... - CBC.ca,2022-11-09 08:00:00,https://news.google.com/__i/rss/rd/articles/CBMiSGh0dHBzOi8vd3d3LmNiYy5jYS9uZXdzL3BvbGl0aWNzL2NhbmFkYS1jaGluYS1pbnRlcmVzdHMtcmlzaW5nLTEuNjY0NTc4NtIBAA?oc=5
National Remembrance Day ceremony marks 80th anniversary of ... - CBC.ca,2022-11-11 08:00:00,https://news.google.com/__i/rss/rd/articles/CBMiSmh0dHBzOi8vd3d3LmNiYy5jYS9uZXdzL3BvbGl0aWNzL3JlbWVtYnJhbmNlLWRheS1jZXJlbW9ueS1kaWVwcGUtMS42NjQ3NDgx0gEA?oc=5
Prime Minister announces byelection in Mississauga-Lakeshore ... - CBC.ca,2022-11-06 07:00:00,https://news.google.com/__i/rss/rd/articles/CBMiS2h0dHBzOi8vd3d3LmNiYy5jYS9uZXdzL3BvbGl0aWNzL2J5ZWxlY3Rpb24tbWlzc2lzc2F1Z2EtbGFrZXNob3JlLTEuNjY0MjYxMdIBAA?oc=5
Vancouver police report 'leaves a bad taste' for critics who say cops ... - CBC.ca,2022-11-09 08:00:00,https://news.google.com/__i/rss/rd/articles/CBMiXGh0dHBzOi8vd3d3LmNiYy5jYS9uZXdzL2NhbmFkYS9icml0aXNoLWNvbHVtYmlhL3ZhbmNvdXZlci1wb2xpY2UtcmVwb3J0LWNyaXRpY2l6ZWQtMS42NjQ2Nzk40gEA?oc=5
84% of Albertans demand government do more to ease inflation's ... - CBC.ca,2022-11-09 08:00:00,https://news.google.com/__i/rss/rd/articles/CBMiamh0dHBzOi8vd3d3LmNiYy5jYS9uZXdzL2NhbmFkYS9jYWxnYXJ5L2FsYmVydGEtaW5mbGF0aW9uLWphbmV0LWJyb3duLXBvbGwtZGFuaWVsbGUtc21pdGgtY2FsZ2FyeS0xLjY2NDEwOTbSAQA?oc=5
Hunting the Hacker of Gatineau - CBC.ca,2022-11-07 08:00:00,https://news.google.com/__i/rss/rd/articles/CBMiR2h0dHBzOi8vd3d3LmNiYy5jYS9uZXdzL2NhbmFkYS9odW50aW5nLXRoZS1oYWNrZXItb2YtZ2F0aW5lYXUtMS42NjQzOTQ20gEA?oc=5
CBC Radio's The House: Test your knowledge with our 2022 quiz - CBC.ca,2022-12-24 08:00:00,https://news.google.com/__i/rss/rd/articles/CBMiR2h0dHBzOi8vd3d3LmNiYy5jYS9uZXdzL3BvbGl0aWNzL3RoZS1ob3VzZS0yMDIyLXF1aXotcG9saXRpY3MtMS42Njg0NjYy0gEA?oc=5
