titles,pubDates,links
RCMP investigating rape threat against Pierre Poilievre's wife - CBC.ca,2022-09-27 07:00:00,https://news.google.com/__i/rss/rd/articles/CBMiRmh0dHBzOi8vd3d3LmNiYy5jYS9uZXdzL3BvbGl0aWNzL3BvaWxpZXZyZS10aHJlYXRzLW1hY2tlbnppZS0xLjY1OTU3MzDSAQA?oc=5
Poilievre's Parliament Hill inner circle takes shape - CBC.ca,2022-09-25 07:00:00,https://news.google.com/__i/rss/rd/articles/CBMiTGh0dHBzOi8vd3d3LmNiYy5jYS9uZXdzL3BvbGl0aWNzL3BvaWxpZXZyZS1jaGllZi1vZi1zdGFmZi1pYW4tdG9kZC0xLjY1OTUzNTPSAQA?oc=5
"Let's get 'real': Trudeau, Poilievre and the big debate over what matters - CBC.ca",2022-09-26 07:00:00,https://news.google.com/__i/rss/rd/articles/CBMiU2h0dHBzOi8vd3d3LmNiYy5jYS9uZXdzL3BvbGl0aWNzL21pbm9yaXR5LXJlcG9ydC10cnVkZWF1LXBvaWxpZXZyZS13aGVycnktMS42NTkzNzk50gEA?oc=5
"On National Day for Truth and Reconciliation, Murray Sinclair ... - CBC.ca",2022-09-30 07:00:00,https://news.google.com/__i/rss/rd/articles/CBMiUmh0dHBzOi8vd3d3LmNiYy5jYS9uZXdzL3BvbGl0aWNzL25hdGlvbmEtZGF5LXRydXRoLXJlY29uY2lsaWF0aW9uLWNhbmFkYS0xLjY2MDA3NDjSAQA?oc=5
Conservative deputy leader says party supports calls for regime ... - CBC.ca,2022-09-28 07:00:00,https://news.google.com/__i/rss/rd/articles/CBMiS2h0dHBzOi8vd3d3LmNiYy5jYS9uZXdzL3BvbGl0aWNzL2NvbnNlcnZhdGl2ZXMtaXJhbi1yZWdpbWUtY2hhbmdlLTEuNjU5OTgyNdIBAA?oc=5
"Border vaccine rules, mandatory use of ArriveCAN, mask mandates ... - CBC.ca",2022-09-26 07:00:00,https://news.google.com/__i/rss/rd/articles/CBMiRWh0dHBzOi8vd3d3LmNiYy5jYS9uZXdzL3BvbGl0aWNzL2Fycml2ZWNhbi1ib3JkZXItY292aWQtZW5kLTEuNjU5NTcxMNIBAA?oc=5
Parliament's climate debate is stuck in the past - CBC.ca,2022-09-29 07:00:00,https://news.google.com/__i/rss/rd/articles/CBMiV2h0dHBzOi8vd3d3LmNiYy5jYS9uZXdzL3BvbGl0aWNzL2NhbmFkYS1jbGltYXRlLWluc3RpdHV0ZS1hZGFwdGF0aW9uLWFuYWx5c2lzLTEuNjU5OTQ5M9IBIGh0dHBzOi8vd3d3LmNiYy5jYS9hbXAvMS42NTk5NDkz?oc=5
The ArriveCAN app is about to become optional. Will anyone use it? - CBC.ca,2022-09-24 07:00:00,https://news.google.com/__i/rss/rd/articles/CBMiYGh0dHBzOi8vd3d3LmNiYy5jYS9uZXdzL3BvbGl0aWNzL2Fycml2ZWNhbi1hcHAtb3B0aW9uYWwtbWFuZGF0b3J5LXByZXNjcmVlbmluZy1jdXN0b21zLTEuNjU5MzcwOdIBAA?oc=5
Speaker won't rule on freelance journalist's accreditation after ... - CBC.ca,2022-09-27 07:00:00,https://news.google.com/__i/rss/rd/articles/CBMiTWh0dHBzOi8vd3d3LmNiYy5jYS9uZXdzL3BvbGl0aWNzL2dlbnVpcy1kYWxlLXNtaXRoLWxhbWUtaG9yc2UtdHdlZXQtMS42NTk3MjU50gEA?oc=5
"Vern White is resigning from the Senate, moving to Finland - CBC.ca",2022-09-29 07:00:00,https://news.google.com/__i/rss/rd/articles/CBMiRmh0dHBzOi8vd3d3LmNiYy5jYS9uZXdzL3BvbGl0aWNzL3Zlcm4td2hpdGUtcmVzaWduaW5nLXNlbmF0ZS0xLjY2MDAzNjbSAQA?oc=5
Leona Alleslev joins crowded Conservative leadership race - CBC.ca,2022-04-06 07:00:00,https://news.google.com/__i/rss/rd/articles/CBMiT2h0dHBzOi8vd3d3LmNiYy5jYS9uZXdzL3BvbGl0aWNzL2xlb25hLWFsbGVzbGV2LWNhbXBhaWduLWFubm91bmNlbWVudC0xLjY0MDk1NDPSASBodHRwczovL3d3dy5jYmMuY2EvYW1wLzEuNjQwOTU0Mw?oc=5
Conservatives blast Liberal budget as NDP strives to balance ... - CBC.ca,2022-04-07 07:00:00,https://news.google.com/__i/rss/rd/articles/CBMiSmh0dHBzOi8vd3d3LmNiYy5jYS9uZXdzL3BvbGl0aWNzLzIwMjItYnVkZ2V0LW9wcG9zaXRpb24tcmVhY3Rpb24tMS42NDEyNjEy0gEA?oc=5
Poilievre calls on Freeland to slash gas taxes ahead of summer ... - CBC.ca,2022-05-25 07:00:00,https://news.google.com/__i/rss/rd/articles/CBMiQGh0dHBzOi8vd3d3LmNiYy5jYS9uZXdzL3BvbGl0aWNzL3BvaWxpZXZyZS1nYXMtdGF4LWN1dC0xLjY0NjM5MTfSAQA?oc=5
Conservative leadership candidates spar over trucker convoy ... - CBC.ca,2022-05-26 07:00:00,https://news.google.com/__i/rss/rd/articles/CBMiWWh0dHBzOi8vd3d3LmNiYy5jYS9uZXdzL3BvbGl0aWNzL2NvbnNlcnZhdGl2ZS1mcmVuY2gtbGFuZ3VhZ2UtbGVhZGVyc2hpcC1kZWJhdGUtMS42NDY0MjMw0gEA?oc=5
Conservative Party member resigns membership over racist email - CBC.ca,2022-05-23 07:00:00,https://news.google.com/__i/rss/rd/articles/CBMiUmh0dHBzOi8vd3d3LmNiYy5jYS9uZXdzL3BvbGl0aWNzL2NvbnNlcnZhdGl2ZS1wYXJ0eS1yZXNpZ25zLXJhY2lzdC1lbWFpbC0xLjY0NjMxMzbSAQA?oc=5
Government disagrees with top court's decision on gunman's parole ... - CBC.ca,2022-05-27 07:00:00,https://news.google.com/__i/rss/rd/articles/CBMiTGh0dHBzOi8vd3d3LmNiYy5jYS9uZXdzL3BvbGl0aWNzL2xhbWV0dGktdG9wLWNvdXJ0LXBhcm9sZS1kZWNpc2lvbi0xLjY0Njg5MTTSAQA?oc=5
Why your property tax bill has two assessed values for your home - CBC.ca,2022-05-21 07:00:00,https://news.google.com/__i/rss/rd/articles/CBMiXmh0dHBzOi8vd3d3LmNiYy5jYS9uZXdzL2NhbmFkYS9wcmluY2UtZWR3YXJkLWlzbGFuZC9wZWktcHJvcGVydHktdGF4LWFzc2Vzc2VkLXZhbHVlcy0xLjY0NjA5MzXSAQA?oc=5
Federal government invokes Emergencies Act for first time ever in ... - CBC.ca,2022-02-14 08:00:00,https://news.google.com/__i/rss/rd/articles/CBMiQ2h0dHBzOi8vd3d3LmNiYy5jYS9uZXdzL3BvbGl0aWNzL3RydWRlYXUtcHJlbWllcnMtY2FiaW5ldC0xLjYzNTA3MzTSAQA?oc=5
Trudeau accuses Conservative MPs of standing with 'people who ... - CBC.ca,2022-02-17 08:00:00,https://news.google.com/__i/rss/rd/articles/CBMiSWh0dHBzOi8vd3d3LmNiYy5jYS9uZXdzL3BvbGl0aWNzL3RydWRlYXUtY29uc2VydmF0aXZlLXN3YXN0aWthcy0xLjYzNTQ5NzDSAQA?oc=5
"Pierre Poilievre returns to his old university club, where 22 years ... - CBC.ca",2022-07-11 07:00:00,https://news.google.com/__i/rss/rd/articles/CBMiaWh0dHBzOi8vd3d3LmNiYy5jYS9uZXdzL2NhbmFkYS9jYWxnYXJ5L3BpZXJyZS1wb2lsaWV2cmUtcGF0cmljay1icm93bi1jb25zZXJ2YXRpdmUtcGFydHktcmVmb3JtLTEuNjUxMzI0N9IBAA?oc=5
Patrick Brown campaign says Charest best alternative for ... - CBC.ca,2022-07-12 07:00:00,https://news.google.com/__i/rss/rd/articles/CBMiWGh0dHBzOi8vd3d3LmNiYy5jYS9uZXdzL3BvbGl0aWNzL3BhdHJpY2stYnJvd24tamVhbi1jaGFyZXN0LWFsdGVybmF0aXZlLWNob2ljZS0xLjY1MTgxMTTSAQA?oc=5
Ex-Tory staffer faces mischief charge for alleged Zoom theft from O'Toole: sources - CBC.ca,2022-07-13 07:00:00,https://news.google.com/__i/rss/rd/articles/CBMiZWh0dHBzOi8vd3d3LmNiYy5jYS9uZXdzL3BvbGl0aWNzL2NvbnNlcnZhdGl2ZS1sZWFkZXJzaGlwLWNhbXBhaWduLWhhY2tpbmctYWxsZWdhdGlvbi1vdG9vbGUtMS42NTE5NzM00gEgaHR0cHM6Ly93d3cuY2JjLmNhL2FtcC8xLjY1MTk3MzQ?oc=5
Downtown Calgary office vacancies hit new high — but it's not all ... - CBC.ca,2022-07-11 07:00:00,https://news.google.com/__i/rss/rd/articles/CBMiZWh0dHBzOi8vd3d3LmNiYy5jYS9uZXdzL2NhbmFkYS9jYWxnYXJ5L2Rvd250b3duLXZhY2FuY2llcy1jYWxnYXJ5LWhpdC1oaWdoLW5ld3Mtbm90LWFsbC1iYWQtMS42NTE2MDAz0gEA?oc=5
"Impact of Rogers outage on Stampede was limited, but some ... - CBC.ca",2022-07-11 07:00:00,https://news.google.com/__i/rss/rd/articles/CBMiZ2h0dHBzOi8vd3d3LmNiYy5jYS9uZXdzL2NhbmFkYS9jYWxnYXJ5L3N0YW1wZWRlLXJvZ2Vycy1vdXRhZ2Utc2Nvb3Rlci1rb3Jlay1lcm5pZS10c3UtY2FsZ2FyeS0xLjY1MTY4NTPSAQA?oc=5
Pierre Poilievre is a 21st century populist who thinks his moment has ... - CBC.ca,2022-09-11 07:00:00,https://news.google.com/__i/rss/rd/articles/CBMiX2h0dHBzOi8vd3d3LmNiYy5jYS9uZXdzL3BvbGl0aWNzL3BpZXJyZS1wb2lsaWV2cmUtcG9wdWxpc3QtY29uc2VydmF0aXZlLWxlYWRlci13aGVycnktMS42NTc5MDE50gEA?oc=5
Convoy donors gave more than $460K to CPC leadership race ... - CBC.ca,2022-09-16 07:00:00,https://news.google.com/__i/rss/rd/articles/CBMiUWh0dHBzOi8vd3d3LmNiYy5jYS9uZXdzL3BvbGl0aWNzL2NvbnZveS1wcm90ZXN0LWNvbnNlcnZhdGl2ZXMtZG9uYXRpb25zLTEuNjU4MjUwN9IBAA?oc=5
"PM, MPs pay tribute to Queen Elizabeth during House of Commons ... - CBC.ca",2022-09-15 07:00:00,https://news.google.com/__i/rss/rd/articles/CBMiTWh0dHBzOi8vd3d3LmNiYy5jYS9uZXdzL3BvbGl0aWNzL3RyaWJ1dGVzLXRvLXF1ZWVuLWhvdXNlLW9mLWNvbW1vbnMtMS42NTgzMjkz0gEA?oc=5
There's a bargain politicians and Alberta public servants make ... - CBC.ca,2022-09-13 07:00:00,https://news.google.com/__i/rss/rd/articles/CBMieGh0dHBzOi8vd3d3LmNiYy5jYS9uZXdzL2NhbmFkYS9jYWxnYXJ5L29waW5pb24tamFyZWQtd2VzbGV5LXNhbXVlbC1jbGFyay1kYW5pZWxsZS1zbWl0aC1wdWJsaWMtc2VydmljZS1iYXJnYWluLTEuNjU3ODE0NNIBAA?oc=5
"Police announce arrest, charges 5 years after homicide of ... - CBC.ca",2022-09-12 07:00:00,https://news.google.com/__i/rss/rd/articles/CBMibWh0dHBzOi8vd3d3LmNiYy5jYS9uZXdzL2NhbmFkYS9icml0aXNoLWNvbHVtYmlhL2dhcnktbG9zY2gtYXJyZXN0LWNoYXJnZXMtY2hlbHNleS1nYXV0aGllci1ob21pY2lkZS0xLjY1NzkwOTbSAQA?oc=5
Residents of district in northeastern B.C. given evacuation order as ... - CBC.ca,2022-09-10 07:00:00,https://news.google.com/__i/rss/rd/articles/CBMidWh0dHBzOi8vd3d3LmNiYy5jYS9uZXdzL2NhbmFkYS9icml0aXNoLWNvbHVtYmlhL2JhdHRsZXNoaXAtbW91bnRhaW4td2lsZGZpcmUtaHVkc29uLXMtaG9wZS1ldmFjdWF0aW9uLW9yZGVyLTEuNjU3OTEyOdIBAA?oc=5
Calgary mental health advocates seek to break stigma on World ... - CBC.ca,2022-09-10 07:00:00,https://news.google.com/__i/rss/rd/articles/CBMihQFodHRwczovL3d3dy5jYmMuY2EvbmV3cy9jYW5hZGEvY2FsZ2FyeS9jYWxnYXJ5LW1lbnRhbC1oZWFsdGgtYWR2b2NhdGVzLXNlZWstdG8tYnJlYWstc3RpZ21hLW9uLXdvcmxkLXN1aWNpZGUtcHJldmVudGlvbi1kYXktMS42NTc4OTMx0gEA?oc=5
Doctors to vote on tentative agreement with Alberta government next week - CBC.ca,2022-09-10 07:00:00,https://news.google.com/__i/rss/rd/articles/CBMiVGh0dHBzOi8vd3d3LmNiYy5jYS9uZXdzL2NhbmFkYS9jYWxnYXJ5L2RvY3RvcnMtYWxiZXJ0YS1nb3Zlcm5tZW50LWRlYWwtdWNwLTEuNjU3ODkyNtIBIGh0dHBzOi8vd3d3LmNiYy5jYS9hbXAvMS42NTc4OTI2?oc=5
Sheila Copps endorses Andrea Horwath in Hamilton's mayoral race - CBC.ca,2022-09-12 07:00:00,https://news.google.com/__i/rss/rd/articles/CBMiTmh0dHBzOi8vd3d3LmNiYy5jYS9uZXdzL2NhbmFkYS9oYW1pbHRvbi9oYW1pbHRvbi1tYXlvci1yYWNlLWVsZWN0aW9uLTEuNjU3NzUxMNIBAA?oc=5
"Shortage of staff leaves parents frustrated, kids without lessons at ... - CBC.ca",2022-09-13 07:00:00,https://news.google.com/__i/rss/rd/articles/CBMiXWh0dHBzOi8vd3d3LmNiYy5jYS9uZXdzL2NhbmFkYS9jYWxnYXJ5L2NhbGdhcnktc3RhZmYtc2hvcnRhZ2UtbGVzcy1zd2ltbWluZy1sZXNzb25zLTEuNjU4MDUyMtIBAA?oc=5
"From the Queen's death to her funeral, here's the sequence of royal ... - CBC.ca",2022-09-14 07:00:00,https://news.google.com/__i/rss/rd/articles/CBMiSGh0dHBzOi8vd3d3LmNiYy5jYS9uZXdzL3dvcmxkL3F1ZWVuLWZ1bmVyYWwtd2F0Y2gta2luZy1jaGFybGVzLTEuNjU3NjY0NtIBAA?oc=5
Calls for help increase as floods continue to devastate Pakistan - CBC.ca,2022-09-13 07:00:00,https://news.google.com/__i/rss/rd/articles/CBMiU2h0dHBzOi8vd3d3LmNiYy5jYS9uZXdzL2NhbmFkYS9jYWxnYXJ5L2NhbGdhcnktY2FuYWRhLXBha2lzdGFuLWZsb29kLWhlbHAtMS42NTgwNzA10gEA?oc=5
"Brown says Conservative establishment, Poilievre campaign worked to oust him from leadership race - CBC.ca",2022-07-06 07:00:00,https://news.google.com/__i/rss/rd/articles/CBMiTWh0dHBzOi8vd3d3LmNiYy5jYS9uZXdzL3BvbGl0aWNzL3BhdHJpY2stYnJvd24tb3VzdGVyLXZhc3N5LWthcGVsb3MtMS42NTEyMzg10gEgaHR0cHM6Ly93d3cuY2JjLmNhL2FtcC8xLjY1MTIzODU?oc=5
Court martial planned for soldier who criticized vaccine mandates ... - CBC.ca,2022-07-05 07:00:00,https://news.google.com/__i/rss/rd/articles/CBMiTGh0dHBzOi8vd3d3LmNiYy5jYS9uZXdzL3BvbGl0aWNzL3RvcHAtc29sZGllci1mYWNpbmctY291cnQtbWFydGlhbC0xLjY1MTEwODHSAQA?oc=5
Kenney suggests Alberta government will show plans for more ... - CBC.ca,2022-07-03 07:00:00,https://news.google.com/__i/rss/rd/articles/CBMiUmh0dHBzOi8vd3d3LmNiYy5jYS9uZXdzL2NhbmFkYS9lZG1vbnRvbi9hbGJlcnRhLWtlbm5leS1pbmZsYXRpb24tc3VwcG9ydC0xLjY1MDkwOTbSAQA?oc=5
Chuckwagon races vs. leadership races: Saddle up for the Calgary political Stampede - CBC.ca,2022-07-08 07:00:00,https://news.google.com/__i/rss/rd/articles/CBMiXGh0dHBzOi8vd3d3LmNiYy5jYS9uZXdzL2NhbmFkYS9jYWxnYXJ5L29waW5pb24tY2FsZ2FyeS1zdGFtcGVkZS11Y3AtY3BjLWxlYWRlcnNoaXAtMS42NTEyNzA50gEgaHR0cHM6Ly93d3cuY2JjLmNhL2FtcC8xLjY1MTI3MDk?oc=5
"Lloyd Parrott, first to enter race to guide the PC Party, says 'now is ... - CBC.ca",2022-07-05 07:00:00,https://news.google.com/__i/rss/rd/articles/CBMiV2h0dHBzOi8vd3d3LmNiYy5jYS9uZXdzL2NhbmFkYS9uZXdmb3VuZGxhbmQtbGFicmFkb3IvbGxveWQtcGFycm90dC1sZWFkZXJzaGlwLTEuNjUxMDgzNtIBAA?oc=5
"Poilievre faces calls to apologize, explain misogynist YouTube tags - CBC.ca",2022-10-06 07:00:00,https://news.google.com/__i/rss/rd/articles/CBMiQWh0dHBzOi8vd3d3LmNiYy5jYS9uZXdzL3BvbGl0aWNzL3BvaWxpZXZyZS15b3V0dWJlLXRhZ3MtMS42NjA4MjA50gEA?oc=5
Ottawa sanctions 34 Iranian officials and entities — Liberal MP says ... - CBC.ca,2022-10-04 07:00:00,https://news.google.com/__i/rss/rd/articles/CBMiSGh0dHBzOi8vd3d3LmNiYy5jYS9uZXdzL3BvbGl0aWNzL2ZlZC1nb3Zlcm5tZW50LWlyYW4tc2FuY3Rpb25zLTEuNjYwMzg0MNIBAA?oc=5
Danielle Smith wants Alberta to challenge carbon tax again — but ... - CBC.ca,2022-10-05 07:00:00,https://news.google.com/__i/rss/rd/articles/CBMiV2h0dHBzOi8vd3d3LmNiYy5jYS9uZXdzL2NhbmFkYS9jYWxnYXJ5L2FsYmVydGEtdWNwLWNhcmJvbi10YXgtY2hhbGxlbmdlLXNtaXRoLTEuNjYwNjQ5MNIBAA?oc=5
Get your top stories in one quick scan - CBC.ca,2022-10-03 07:00:00,https://news.google.com/__i/rss/rd/articles/CBMiPmh0dHBzOi8vd3d3LmNiYy5jYS9uZXdzL21vcm5pbmctYnJpZWYtb2N0b2Jlci0zLTIwMjItMS42NjAxODcz0gEA?oc=5
"Freeland's mini-budget waives interest on student loans, sends ... - CBC.ca",2022-11-03 07:00:00,https://news.google.com/__i/rss/rd/articles/CBMiR2h0dHBzOi8vd3d3LmNiYy5jYS9uZXdzL3BvbGl0aWNzL2ZhbGwtZWNvbm9taWMtc3RhdGVtZW50LTIwMjItMS42NjM5NDQw0gEA?oc=5
"Amid growing criticism, Macklem says Bank of Canada's ... - CBC.ca",2022-10-30 07:00:00,https://news.google.com/__i/rss/rd/articles/CBMiTWh0dHBzOi8vd3d3LmNiYy5jYS9uZXdzL3BvbGl0aWNzL21hY2tsZW0tYm9jLWluZmxhdGlvbi1pbmRlcGVuZGVuY2UtMS42NjM0NzE00gEA?oc=5
Danielle Smith talks Ottawa. Albertans have health and inflation on ... - CBC.ca,2022-11-04 07:00:00,https://news.google.com/__i/rss/rd/articles/CBMiaWh0dHBzOi8vd3d3LmNiYy5jYS9uZXdzL2NhbmFkYS9jYWxnYXJ5L2FsYmVydGEtZGFuaWVsbGUtc21pdGgtaXNzdWVzLXBvbGwtaGVhbHRoLWNhcmUtaW5mbGF0aW9uLTEuNjY0MDA3NdIBAA?oc=5
Shortage of children's pain relievers is crowding the ER — but there ... - CBC.ca,2022-11-04 07:00:00,https://news.google.com/__i/rss/rd/articles/CBMiZGh0dHBzOi8vd3d3LmNiYy5jYS9uZXdzL2NhbmFkYS9zaG9ydGFnZS1tZWRpY2F0aW9uLXBhaW4tcmVsaWVmLWNvbGQtZmx1LWtpZHMtdHlsZW5vbC1hZHZpbC0xLjY2Mzg1MzDSAQA?oc=5
Manitoba premier puts other priorities ahead of Alberta's request to ... - CBC.ca,2022-10-31 07:00:00,https://news.google.com/__i/rss/rd/articles/CBMiamh0dHBzOi8vd3d3LmNiYy5jYS9uZXdzL2NhbmFkYS9tYW5pdG9iYS9tYW5pdG9iYS1vdGhlci1wcmlvcml0aWVzLWFsYmVydGEtc2hpcHBpbmctb2lsLWNodXJjaGlsbC0xLjY2MzU0NTLSAQA?oc=5
You can now scan your poppy to learn the stories of fallen Canadian ... - CBC.ca,2022-11-02 07:00:00,https://news.google.com/__i/rss/rd/articles/CBMiVGh0dHBzOi8vd3d3LmNiYy5jYS9uZXdzL2NhbmFkYS9jYWxnYXJ5L3BvcHB5LXN0b3JpZXMtcm95YWwtY2FuYWRpYW4tbGVnaW9uLTEuNjYzODU0MNIBAA?oc=5
Convoy lawyer says protesters were receiving a 'steady stream' of ... - CBC.ca,2022-11-02 07:00:00,https://news.google.com/__i/rss/rd/articles/CBMiUmh0dHBzOi8vd3d3LmNiYy5jYS9uZXdzL3BvbGl0aWNzL3dpbHNvbi1tYXJhenpvLXBhdC1raW5nLWVtZXJnZW5jaWVzLWFjdC0xLjY2Mzc3NjbSAQA?oc=5
"Amid local tensions, threats against Antigonish mayor reported to ... - CBC.ca",2022-11-01 07:00:00,https://news.google.com/__i/rss/rd/articles/CBMiZmh0dHBzOi8vd3d3LmNiYy5jYS9uZXdzL2NhbmFkYS9ub3ZhLXNjb3RpYS90aHJlYXRzLWFnYWluc3QtYW50aWdvbmlzaC1tYXlvci1yZXBvcnRlZC10by1yY21wLTEuNjYzNDgxMdIBAA?oc=5
Get informed on the top stories of the day in one quick scan - CBC.ca,2022-11-03 07:00:00,https://news.google.com/__i/rss/rd/articles/CBMiRmh0dHBzOi8vd3d3LmNiYy5jYS9uZXdzL2NhbmFkYS9tb3JuaW5nLWJyaWVmLW5vdmVtYmVyLTMtMjAyMi0xLjY2Mzc2NTjSASBodHRwczovL3d3dy5jYmMuY2EvYW1wLzEuNjYzNzY1OA?oc=5
Pierre Poilievre thinks he can win over new Canadians. Here's how ... - CBC.ca,2022-12-18 08:00:00,https://news.google.com/__i/rss/rd/articles/CBMiVGh0dHBzOi8vd3d3LmNiYy5jYS9uZXdzL3BvbGl0aWNzL2NvbnNlcnZhdGl2ZS1pbW1pZ3JhdGlvbi1vdXRyZWFjaC1lZmZvcnRzLTEuNjY5MDI0NNIBAA?oc=5
Ex-Reform leader warns Liberals will weaponize Conservative ... - CBC News,2022-08-23 07:00:00,https://news.google.com/__i/rss/rd/articles/CBMiYGh0dHBzOi8vd3d3LmNiYy5jYS9uZXdzL3BvbGl0aWNzL3ByZXN0b24tbWFubmluZy1waWVycmUtcG9pbGlldnJlLXRydWRlYXUtY29uc2VydmF0aXZlLTEuNjU1ODc5NNIBAA?oc=5
People's Party leader takes aim at Conservative leadership ... - CBC.ca,2022-08-23 07:00:00,https://news.google.com/__i/rss/rd/articles/CBMiSWh0dHBzOi8vd3d3LmNiYy5jYS9uZXdzL2NhbmFkYS9tYW5pdG9iYS9tYXhpbWUtYmVybmllci13aW5uaXBlZy0xLjY1NTk2NzfSAQA?oc=5
Why choosing Alberta's next premier largely lies in the hands of folks ... - CBC.ca,2022-08-25 07:00:00,https://news.google.com/__i/rss/rd/articles/CBMiWWh0dHBzOi8vd3d3LmNiYy5jYS9uZXdzL2NhbmFkYS9jYWxnYXJ5L3VjcC1tZW1iZXJzaGlwLXJpZGluZy1icmVha2Rvd24tYW5hbHlzaXMtMS42NTYxMzU50gEA?oc=5
All about that base: Why UCP leadership contenders probably aren't ... - CBC.ca,2022-08-20 07:00:00,https://news.google.com/__i/rss/rd/articles/CBMiXmh0dHBzOi8vd3d3LmNiYy5jYS9uZXdzL2NhbmFkYS9jYWxnYXJ5L3VjcC1sZWFkZXJzaGlwLXNvdmVyZWlnbnR5LWJhc2UtbmFycm93LXN1YnNldC0xLjY1NTcyMzDSAQA?oc=5
"How Pierre Poilievre is winning new support among young, diverse ... - CBC.ca",2022-09-18 07:00:00,https://news.google.com/__i/rss/rd/articles/CBMiT2h0dHBzOi8vd3d3LmNiYy5jYS9uZXdzL3BvbGl0aWNzL3BpZXJyZS1wb2lsaWV2cmUtYmlwb2MteW91dGgtc3VwcG9ydC0xLjY1ODYwNjXSAQA?oc=5
Parliament had a lively summer. It's about to get louder - CBC.ca,2022-09-18 07:00:00,https://news.google.com/__i/rss/rd/articles/CBMiR2h0dHBzOi8vd3d3LmNiYy5jYS9uZXdzL3BvbGl0aWNzL3BhcmxpYW1lbnQtdHJ1ZGVhdS1wb2lsaWV2cmUtMS42NTg1ODcw0gEA?oc=5
"So who's 'woke,' what does it mean and how is it being used in ... - CBC.ca",2022-09-17 07:00:00,https://news.google.com/__i/rss/rd/articles/CBMiTGh0dHBzOi8vd3d3LmNiYy5jYS9uZXdzL3BvbGl0aWNzL2xpYmVyYWxzLWRpc3RhbmNlLWZyb20td29rZS1sYWJlbC0xLjY1ODYxMzbSAQA?oc=5
Liberal House leader urges MPs to ' rise to the occasion' as House of Commons resumes - CBC.ca,2022-09-20 07:00:00,https://news.google.com/__i/rss/rd/articles/CBMiPWh0dHBzOi8vd3d3LmNiYy5jYS9uZXdzL3BvbGl0aWNzL2hvdXNlLXJldHVybnMtZmFsbC0xLjY1ODg0ODfSASBodHRwczovL3d3dy5jYmMuY2EvYW1wLzEuNjU4ODQ4Nw?oc=5
"Poilievre's rise leading to talk of easing border restrictions, Tory MPs ... - CBC.ca",2022-09-22 07:00:00,https://news.google.com/__i/rss/rd/articles/CBMiVmh0dHBzOi8vd3d3LmNiYy5jYS9uZXdzL3BvbGl0aWNzL2NvbnNlcnZhdGl2ZXMtcG9pbGlldnJlLWJvcmRlci1yZXN0cmljdGlvbnMtMS42NTkxMDA00gEA?oc=5
Liberals reveal details of new Canada Dental Benefit - CBC.ca,2022-09-21 07:00:00,https://news.google.com/__i/rss/rd/articles/CBMiSWh0dHBzOi8vd3d3LmNiYy5jYS9uZXdzL3BvbGl0aWNzL2NhbmFkYS1kZW50YWwtY2FyZS1ob3VzaW5nLWdzdC0xLjY1ODkwMjfSAQA?oc=5
Affordability in Canada is at a crisis point — and politicians don't ... - CBC.ca,2022-09-18 07:00:00,https://news.google.com/__i/rss/rd/articles/CBMiUGh0dHBzOi8vd3d3LmNiYy5jYS9uZXdzL3BvbGl0aWNzL2luZmxhdGlvbi1wb2xpdGljYWwtcGFydGllcy1zb2x1dGlvbnMtMS42NTg2NzM20gEA?oc=5
MPs honour 1972 Summit Series players to mark 50th anniversary - CBC.ca,2022-09-22 07:00:00,https://news.google.com/__i/rss/rd/articles/CBMiWmh0dHBzOi8vd3d3LmNiYy5jYS9uZXdzL3BvbGl0aWNzL21lbWJlcnMtb2YtcGFybGlhbWVudC1zdW1taXQtc2VyaWVzLWFubml2ZXJzYXJ5LTEuNjU5MjA5NNIBIGh0dHBzOi8vd3d3LmNiYy5jYS9hbXAvMS42NTkyMDk0?oc=5
Where you buy your orange shirt matters — here's why - CBC.ca,2022-09-24 07:00:00,https://news.google.com/__i/rss/rd/articles/CBMiT2h0dHBzOi8vd3d3LmNiYy5jYS9uZXdzL2NhbmFkYS9jYWxnYXJ5L29yYW5nZS1zaGlydC1kYXktY2FsZ2FyeS1mcmF1ZC0xLjY1ODczODnSAQA?oc=5
Calgary police say woman in hospital after drive-by shooting in ... - CBC.ca,2022-09-19 07:00:00,https://news.google.com/__i/rss/rd/articles/CBMiUmh0dHBzOi8vd3d3LmNiYy5jYS9uZXdzL2NhbmFkYS9jYWxnYXJ5L2NhbGdhcnktcG9saWNlLXNob290aW5nLW5vcnRod2VzdC0xLjY1ODcwOTPSAQA?oc=5
"NDP's Jagmeet Singh denounces trucker convoy, disagrees with ... - CBC News",2022-01-26 08:00:00,https://news.google.com/__i/rss/rd/articles/CBMiTmh0dHBzOi8vd3d3LmNiYy5jYS9uZXdzL3BvbGl0aWNzL3NpbmdoLXRydWNrZXItY29udm95LWJyb3RoZXItaW4tbGF3LTEuNjMyODY4OdIBAA?oc=5
Conservative MPs accuse Trudeau of pushing 'vaccine vendetta' as ... - CBC News,2022-01-24 08:00:00,https://news.google.com/__i/rss/rd/articles/CBMiVWh0dHBzOi8vd3d3LmNiYy5jYS9uZXdzL3BvbGl0aWNzL3RydWNrZXJzLXZhY2NpbmUtdmFuZGV0dGEtY29uc2VydmF0aXZlLW1wcy0xLjYzMjU3NjHSAQA?oc=5
"As the pandemic rages on, the political debate moves to the ... - CBC News",2022-01-25 08:00:00,https://news.google.com/__i/rss/rd/articles/CBMiVWh0dHBzOi8vd3d3LmNiYy5jYS9uZXdzL3BvbGl0aWNzL2NvdmlkLXZhY2NpbmUtbWFuZGF0ZS10cnVja2VyLWNvbnNlcnZhdGl2ZS0xLjYzMjU5OTjSAQA?oc=5
"In a pitch to cryptocurrency investors, Poilievre says he wants ... - CBC News",2022-03-28 07:00:00,https://news.google.com/__i/rss/rd/articles/CBMiQ2h0dHBzOi8vd3d3LmNiYy5jYS9uZXdzL3BvbGl0aWNzL3BvaWxpZXZyZS1iaXRjb2luLXBvbGljeS0xLjYzOTk5ODbSAQA?oc=5
Conservative leadership candidates jockey for position on the ... - CBC News,2022-03-31 07:00:00,https://news.google.com/__i/rss/rd/articles/CBMiTWh0dHBzOi8vd3d3LmNiYy5jYS9uZXdzL3BvbGl0aWNzL2NhcmJvbi10YXgtcG9pbGlldnJlLWNoYXJlc3QtYnJvd24tMS42NDAyODgx0gEA?oc=5
"Liberal climate plan looks to guarantee a carbon price, no matter ... - CBC News",2022-03-31 07:00:00,https://news.google.com/__i/rss/rd/articles/CBMiQWh0dHBzOi8vd3d3LmNiYy5jYS9uZXdzL2J1c2luZXNzL2Jha3gtY2FyYm9uLXByaWNlLWNjZmQtMS42NDAyODA00gEA?oc=5
Poilievre to skip 3rd Conservative leadership debate as voting ... - CBC.ca,2022-07-21 07:00:00,https://news.google.com/__i/rss/rd/articles/CBMiT2h0dHBzOi8vd3d3LmNiYy5jYS9uZXdzL3BvbGl0aWNzL2NvbnNlcnZhdGl2ZS10aGlyZC1sZWFkZXJzaGlwLWRlYmF0ZS0xLjY1Mjc0NDDSAQA?oc=5
Pierre Poilievre would approve runway expansion to bring jets to ... - CBC News,2022-07-21 07:00:00,https://news.google.com/__i/rss/rd/articles/CBMiU2h0dHBzOi8vd3d3LmNiYy5jYS9uZXdzL3BvbGl0aWNzL3BvaWxpZXZyZS1haXJwb3J0LWJpbGx5LWJpc2hvcC1leHBhbnNpb24tMS42NTI3OTc10gEA?oc=5
Brown says Conservative Party would 'manufacture anything' to oust ... - CBC.ca,2022-07-18 07:00:00,https://news.google.com/__i/rss/rd/articles/CBMiXGh0dHBzOi8vd3d3LmNiYy5jYS9uZXdzL3BvbGl0aWNzL3BhdHJpY2stYnJvd24tY29uc2VydmF0aXZlLWxlYWRlcnNoaXAtYWxsZWdhdGlvbnMtMS42NTI0MzQy0gEA?oc=5
Baber pitching himself as more than second choice in race to lead ... - CBC News,2022-07-20 07:00:00,https://news.google.com/__i/rss/rd/articles/CBMiW2h0dHBzOi8vd3d3LmNiYy5jYS9uZXdzL3BvbGl0aWNzL2JhYmVyLWNvbnNlcnZhdGl2ZS1sZWFkZXJzaGlwLXJhY2UtcmFua2VkLWJhbGxvdC0xLjY1MjYyMDPSAQA?oc=5
Get informed on the top stories of the day in one quick scan - CBC News,2022-07-19 07:00:00,https://news.google.com/__i/rss/rd/articles/CBMiPGh0dHBzOi8vd3d3LmNiYy5jYS9uZXdzL21vcm5pbmctYnJpZWYtanVseS0xOS0yMDIyLTEuNjUyMzczN9IBIGh0dHBzOi8vd3d3LmNiYy5jYS9hbXAvMS42NTIzNzM3?oc=5
